,id,year,month,day,country,region,state,city,latitude,longitude,summary,target,tgroup,weapon,fatalities,injuries
142085,201501020080,2015,1,2,Philippines,Southeast Asia,Basilan,Lamitan,6.6607899999999995,122.140401,"01/02/2015: Security forces found and defused an explosive device planted in a passenger jeep in Lamitan city, Basilan province, Philippines. No group claimed responsibility for the incident.",Private Citizens & Property,Unknown,Explosives/Bombs/Dynamite,0,0
142101,201501030047,2015,1,3,Philippines,Southeast Asia,Sultan Kudarat,Sumilalao,6.7001,124.73288000000001,"01/03/2015: Assailants attacked a military detachment in Sumilalao village, President Quirino town, Sultan Kudarat province, Philippines. This was one of two similar attacks in the Philippines on the same date. One soldier was killed and three soldiers were wounded across both attacks. No group claimed responsibility; however, sources attributed the incident to the Bangsamoro Islamic Freedom Movement (BIFM).",Military,Bangsamoro Islamic Freedom Movement (BIFM),Firearms,1,2
142102,201501030048,2015,1,3,Philippines,Southeast Asia,Maguindanao,Kulasi,6.802292,124.677007,"01/03/2015: Assailants attacked a military detachment in Kulasi village, General Salipada K. Pendatun town, Maguindanao province, Philippines. This was one of two similar attacks in the Philippines on the same date. One soldier was killed and three soldiers were injured across both attacks. No group claimed responsibility; however, sources attributed the incident to the Bangsamoro Islamic Freedom Movement (BIFM).",Military,Bangsamoro Islamic Freedom Movement (BIFM),Firearms,0,1
142175,201501040067,2015,1,4,Philippines,Southeast Asia,Northern Samar,Napo,12.53232,125.12051799999999,"01/04/2015: Assailants stopped a soldier along a road in Napo village, Palapag town, Northern Samar province, Philippines. When the soldier resisted, the attackers opened fire, killing the soldier. No group claimed responsibility; however, sources attributed the incident to the New People's Army (NPA).",Military,New People's Army (NPA),Firearms,1,0
142219,201501050056,2015,1,5,Philippines,Southeast Asia,Pangasinan,Punta,15.814055999999999,120.32063500000001,"01/05/2015: Assailants opened fire on Dionisio Viray in Punta village, Mangatarem town, Pangasinan province, Philippines. Viray, a village councilor, was killed in the attack. No group claimed responsibility for the incident.",Government (General),Unknown,Firearms,1,0
142220,201501050057,2015,1,5,Philippines,Southeast Asia,Isabela,Patul,16.6715,121.5318,"01/05/2015: Assailants opened fire on George Apostol in Patul village, Isabela province, Philippines. Apostol, a village councilor, was killed in the attack. No group claimed responsibility for the incident.",Government (General),Unknown,Firearms,1,0
142246,201501060029,2015,1,6,Philippines,Southeast Asia,Sulu,Jolo,6.05,121.0,"01/06/2015: Assailants kidnapped a child in Asturias village, Jolo city, Sulu province, Philippines. The hostage was released on February 20, 2015. No group claimed responsibility for the incident; however, sources attributed the abduction to the Abu Sayyaf Group (ASG).",Private Citizens & Property,Abu Sayyaf Group (ASG),Firearms,0,0
142251,201501060034,2015,1,6,Philippines,Southeast Asia,Maguindanao,Guindulungan,6.978003999999999,124.38739699999999,"01/06/2015: Assailants fired rockets at the house of Akmad Ampatuan, a former mayor, in Guindulungan area, Shariff Aguak town, Maguindanao province, Philippines. A bystander was wounded in the attack. No group claimed responsibility for the incident; however, sources suspected the involvement of Tamano Mamalapat, a former member of the Moro Islamic Liberation Front (MILF).",Government (General),Unknown,Explosives/Bombs/Dynamite,0,1
142271,201501070015,2015,1,7,Philippines,Southeast Asia,Lanao del Sur,Bubong,7.885051,124.16620900000001,"01/07/2015: Assailants attacked an election official in Bubong town, Lanao del Sur province, Philippines. The official, Bashier Ampa, was killed in the attack. No group claimed responsibility for the incident.",Government (General),Unknown,Firearms,1,0
142279,201501070030,2015,1,7,Philippines,Southeast Asia,Basilan,Lukketun,6.426872,122.011242,"01/07/2015: An explosive device detonated at a rubber plantation in Lukketun village, Sumisip town, Basilan province, Philippines. One worker was injured in the blast. No group claimed responsibility for the incident.",Business,Unknown,Explosives/Bombs/Dynamite,0,1
142310,201501070089,2015,1,7,Philippines,Southeast Asia,Siquijor,Poblacion,9.1584,123.4996,"01/07/2015: An explosive device planted in the car of a judge detonated in Poblacion village, San Juan town, Siquijor province, Philippines. No one was injured in the blast, but the car was destroyed. No group claimed responsibility for the incident.",Government (General),Unknown,Explosives/Bombs/Dynamite,0,0
142346,201501080051,2015,1,8,Philippines,Southeast Asia,Bataan,Tuyo,14.694419,120.53873600000001,"01/08/2015: Assailants opened fire on Nerlita Ledesma in Tuyo village, Bataan province, Philippines. Ledesma, a tabloid reporter, was killed in the attack. No group claimed responsibility for the incident.",Journalists & Media,Unknown,Firearms,1,0
142405,201501090088,2015,1,9,Philippines,Southeast Asia,Maguindanao,Shariff Aguak,6.861545,124.443546,"01/09/2015: Assailants attacked a military base with rockets in Shariff Aguak town, Maguindanao province, Philippines. There were no reports of casualties from the attack. No group claimed responsibility; however sources attributed the incident to the Bangsamoro Islamic Freedom Movement (BIFM), stating that they were retaliating after the military's capture of their main camp.",Military,Bangsamoro Islamic Freedom Movement (BIFM),Explosives/Bombs/Dynamite,0,0
142412,201501090095,2015,1,9,Philippines,Southeast Asia,Cavite,Imus,14.420209,120.939674,"01/09/2015: Assailants opened fire on Wahid Micawayan Saliling in Bayan Luma II area, Imus city, Cavite province, Philippines. Saliling, a village chair, was killed in the attack. No group claimed responsibility for the incident.",Government (General),Unknown,Firearms,1,0
142439,201501100063,2015,1,10,Philippines,Southeast Asia,Sulu,Kiyutaan,5.969382,121.04401599999998,"01/10/2015: Assailants launched grenades at a Barangay Peacekeeping Action Team (BPAT) patrol in Kiyutaan village, Sulu province, Philippines. A BPAT member was injured in the attack. No group claimed responsibility for the incident; however, sources attributed the attack to the Abu Sayyaf Group (ASG).",Police,Abu Sayyaf Group (ASG),Explosives/Bombs/Dynamite,0,1
142458,201501100084,2015,1,10,Philippines,Southeast Asia,North Cotabato,Pikit,7.053719999999999,124.67358700000001,"01/10/2015: An explosive device was discovered and safely defused in Pikit town, North Cotabato province, Philippines. No group claimed responsibility for the incident; however, sources attributed the attack to the Bangsamoro Islamic Freedom Movement (BIFM).",Unknown,Bangsamoro Islamic Freedom Movement (BIFM),Explosives/Bombs/Dynamite,0,0
142590,201501130023,2015,1,13,Philippines,Southeast Asia,Maguindanao,Galakit,7.051969000000001,124.724173,"01/13/2015: An explosive device detonated at a National Grid Corporation of the Philippines (NGCP) transmission tower in Galakit village, Maguindanao province, Philippines. There were no reported casualties, although the tower was damaged in the blast. No group claimed responsibility for the incident; however, sources attributed the attack to the Bangsamoro Islamic Freedom Movement (BIFM).",Utilities,Bangsamoro Islamic Freedom Movement (BIFM),Explosives/Bombs/Dynamite,0,0
142591,201501130024,2015,1,13,Philippines,Southeast Asia,Basilan,Tipo-Tipo,6.497901000000001,122.120277,"01/13/2015: A grenade detonated at a construction site in Tipo-Tipo town, Basilan province, Philippines. There were no reported casualties, although road construction equipment was damaged in the blast. No group claimed responsibility for the incident; however, sources attributed the attack to the Abu Sayyaf Group (ASG).",Business,Abu Sayyaf Group (ASG),Explosives/Bombs/Dynamite,0,0
142592,201501130025,2015,1,13,Philippines,Southeast Asia,North Cotabato,Carmen,7.204124,124.798022,"01/13/2015: Assailants threw a grenade near a civilian residence in Carmen town, North Cotabato province, Philippines. A civilian was injured in the blast. No group claimed responsibility for the incident.",Private Citizens & Property,Unknown,Explosives/Bombs/Dynamite,0,1
142649,201501140037,2015,1,14,Philippines,Southeast Asia,North Cotabato,Pikit,7.054666,124.674481,"01/14/2015: An explosive device detonated in Pikit town, North Cotabato province, Philippines. There were no reported casualties in the attack. No group claimed responsibility for the incident; however, sources attributed the attack to the Bangsamoro Islamic Freedom Movement (BIFM).",Unknown,Bangsamoro Islamic Freedom Movement (BIFM),Explosives/Bombs/Dynamite,0,0
142696,201501150039,2015,1,15,Philippines,Southeast Asia,Basilan,Cadayan,6.664421000000001,122.18539799999999,"01/15/2015: Assailants abducted three construction workers from Cadayan village, Basilan province, Philippines. The workers were rescued an hour after the abduction. No group claimed responsibility for the incident; however, sources attributed the attack to the Abu Sayyaf Group (ASG).",Business,Abu Sayyaf Group (ASG),Unknown,0,0
142821,201501170075,2015,1,17,Philippines,Southeast Asia,Basilan,Matarling,6.601844,121.906967,"01/17/2015: Assailants opened fire on an Armed Forces of the Philippines (AFP) soldier in Matarling village, Basilan province, Philippines. The soldier was killed in the attack. No group claimed responsibility for the incident.",Military,Unknown,Firearms,1,0
142845,201501180031,2015,1,18,Philippines,Southeast Asia,Sulu,Danag,6.02326,121.091117,"01/18/2015: Assailants opened fire on an Intelligence Service of the Armed Forces of the Philippines (ISAFP) officer in Danag village, Sulu province, Philippines. The officer, Arjan Punzalan, was killed in the attack. No group claimed responsibility for the incident; however, sources attributed the attack to the Abu Sayyaf Group (ASG).",Military,Abu Sayyaf Group (ASG),Firearms,1,0
142863,201501180067,2015,1,18,Philippines,Southeast Asia,Davao Oriental,New Visayas,6.941653,126.058523,"01/18/2015: Assailants attacked an Armed Forces of the Philippines (AFP) patrol in New Visayas area, Lupon, Davao Oriental, Philippines. No casualties were reported. No group claimed responsibility for the incident; however, sources attributed the attack to the New Peoples Army (NPA).",Military,New People's Army (NPA),Firearms,0,0
142884,201501190022,2015,1,19,Philippines,Southeast Asia,North Cotabato,Batulawan,7.074574,124.668732,"01/19/2015: An explosive device detonated at a power transmission tower in Batulawan village, North Cotabato province, Philippines. No casualties were reported. No group claimed responsibility for the incident; however, security officials attributed the attack to the Bangsamoro Islamic Freedom Movement (BIFM).",Utilities,Bangsamoro Islamic Freedom Movement (BIFM),Explosives/Bombs/Dynamite,0,0
142885,201501190023,2015,1,19,Philippines,Southeast Asia,North Cotabato,Kabacan,7.10728,124.827031,"01/19/2015: An explosive device detonated at a public market in Kabacan town, North Cotabato province, Philippines. No casualties were reported. No group claimed responsibility for the incident; however, authorities attributed the attack to the Bangsamoro Islamic Freedom Movement (BIFM).",Private Citizens & Property,Bangsamoro Islamic Freedom Movement (BIFM),Explosives/Bombs/Dynamite,0,0
142934,201501200032,2015,1,20,Philippines,Southeast Asia,North Cotabato,South Manuangan,7.285664,124.410877,"01/20/2015: Security forces discovered and defused an explosive device on a highway in South Manuangan village, North Cotabato province, Philippines. No group claimed responsibility for the incident.",Unknown,Unknown,Explosives/Bombs/Dynamite,0,0
142935,201501200033,2015,1,20,Philippines,Southeast Asia,South Cotabato,Spring,6.198367,124.83211299999999,"01/20/2015: Assailants set fire to a bulldozer in Spring area, South Cotabato province, Philippines. No casualties were reported. No group claimed responsibility for the incident; however, sources attributed the attack to the New People's Army (NPA).",Business,New People's Army (NPA),Incendiary,0,0
142937,201501200035,2015,1,20,Philippines,Southeast Asia,Surigao del Norte,Mabini,9.718216,125.476177,"01/20/2015: Assailants attacked a construction site in Mabini area, Surigao del Norte province, Philippines. No casualties were reported, but heavy pieces of construction equipment were damaged in the assault. No group claimed responsibility for the incident; however, sources attributed the attack to the New People's Army (NPA).",Business,New People's Army (NPA),Incendiary,0,0
142938,201501200036,2015,1,20,Philippines,Southeast Asia,Bukidnon,Lilingayon,7.9912160000000005,124.969311,"01/20/2015: Assailants attacked a banana plantation in Lilingayon village, Bukidnon province, Philippines. No casualties were reported. No group claimed responsibility for the incident; however, a military official attributed the attack to the New People's Army (NPA).",Business,New People's Army (NPA),Incendiary,0,0
142964,201501200089,2015,1,20,Philippines,Southeast Asia,Surigao del Sur,Unknown,8.82703,126.294545,"01/20/2015: Assailants set explosive devices and deployed snipers along a road in Surigao del Sur province, Philippines. The outcome of the attack is unknown. No group claimed responsibility; however, sources attributed the attack to the New Peoples Army (NPA).",Unknown,New People's Army (NPA),Explosives/Bombs/Dynamite,0,0
142965,201501200090,2015,1,20,Philippines,Southeast Asia,Camarines Sur,Goa,13.6978,123.4892,"01/20/2015: Assailants attacked a military patrol in Goa town, Camarines Sur province, Philippines. No casualties were reported. No group claimed responsibility for the incident; however, sources attributed the attack to the New People's Army (NPA).",Military,New People's Army (NPA),Firearms,0,0
142979,201501200110,2015,1,20,Philippines,Southeast Asia,Metropolitan Manila,Taguig,14.495531,121.062278,"01/20/2015: Assailants opened fire on a village chief in Lower Bicutan neighborhood, Taguig city, Metropolitan Manila Territory, Philippines. The chief, Aurelio Padilla, was killed in the attack. No group claimed responsibility for the incident.",Government (General),Unknown,Firearms,1,0
142992,201501210013,2015,1,21,Philippines,Southeast Asia,Basilan,Isabela City,6.710942999999999,121.97499199999999,"01/21/2015: An explosive device was discovered and defused in front of Ayub Abdil's residence in Kaumpurnah Zone 3 neighborhood, Isabela City, Basilan province, Philippines. No group claimed responsibility for the incident.",Private Citizens & Property,Unknown,Explosives/Bombs/Dynamite,0,0
143012,201501210040,2015,1,21,Philippines,Southeast Asia,Basilan,Sumisip district,6.532280999999999,121.998024,"01/21/2015: Assailants attacked Philippine Army (PA) soldiers in Sumisip district, Basilan province, Philippines. There were no reported casualties in the attack. No group claimed responsibility for the incident; however, sources attributed it to the Abu Sayyaf Group (ASG).",Military,Abu Sayyaf Group (ASG),Firearms,0,0
143039,201501220030,2015,1,22,Philippines,Southeast Asia,Basilan,Sumisip,6.41971,121.970302,"01/22/2015: An explosive device detonated after it was struck by an armored personnel carrier on Pamatsaken-Baiwas Road near Sumisip town, Basilan province, Philippines. There were no reported casualties, but the carrier was damaged in the blast. No group claimed responsibility for the incident; however, sources attributed it to the Abu Sayyaf Group (ASG).",Military,Abu Sayyaf Group (ASG),Explosives/Bombs/Dynamite,0,0
143040,201501220032,2015,1,22,Philippines,Southeast Asia,Basilan,Sumisip,6.419441,121.970697,"01/22/2015: An explosive device was discovered and defused at the old school building in Sumisip town, Basilan province, Philippines. No group claimed responsibility for the incident.",Educational Institution,Unknown,Explosives/Bombs/Dynamite,0,0
143069,201501230014,2015,1,23,Philippines,Southeast Asia,Zamboanga Sibugay,Zamboanga City,6.928028,122.094939,"01/23/2015: An explosive device detonated at a bar across the street from a bus terminal in Guiwan neighborhood, Zamboanga city, Zamboanga Sibugay province, Philippines. Two people were killed and 52 were wounded in the blast. No group claimed responsibility for the incident; however, sources attributed it to the Abu Sayyaf Group (ASG).",Business,Abu Sayyaf Group (ASG),Explosives/Bombs/Dynamite,2,52
143102,201501240009,2015,1,24,Philippines,Southeast Asia,Zamboanga Sibugay,Roseller Lim,7.659503,122.46939099999999,"01/24/2015: Assailants abducted three people, including Noui Hong Sung, in Roseller Lim town, Zamboanga Sibugay province, Philippines. Two of the hostages escaped shortly after the abduction and Sung, a Korean businessperson, was killed on October 31, 2015. No group claimed responsibility; however, authorities attributed the attack to the Abu Sayyaf Group (ASG) and the Waning Abdusalam Group (WAG).",Private Citizens & Property,Abu Sayyaf Group (ASG),Firearms,0,0
143234,201501260040,2015,1,26,Philippines,Southeast Asia,Cagayan,Callao Norte,18.067695,121.631648,"01/26/2015: Assailants attacked the residence of Jay Isaac Agatep III in Callao Norte village, Cagayan province, Philippines. Agatep, a municipal councilor, was unharmed, although the assailants dragged his father from the house and opened fire on him. Agatep's father was killed in the attack. No group claimed responsibility for the incident; however, sources attributed the attack to New People's Army (NPA).",Government (General),New People's Army (NPA),Firearms,1,0
143267,201501260078,2015,1,27,Philippines,Southeast Asia,Surigao del Norte,Gigaquit,9.595312,125.69853400000001,"01/27/2015: Assailants opened fire on a military patrol in Katikoyan area, Gigaquit village, Surigao del Norte province, Philippines. One soldier was killed in the attack. No group claimed responsibility for the incident; however, sources attributed the attack to the New People's Army (NPA).",Military,New People's Army (NPA),Firearms,1,0
143281,201501270012,2015,1,27,Philippines,Southeast Asia,North Cotabato,Pikit,7.052832,124.67488200000001,"01/27/2015: An explosive device detonated prematurely in Pikit town, North Cotabato province, Philippines. Two assailants were killed and a civilian was injured in the blast. No group claimed responsibility for the incident; however, sources attributed the attack to the Bangsamoro Islamic Freedom Movement (BIFM).",Unknown,Bangsamoro Islamic Freedom Movement (BIFM),Explosives/Bombs/Dynamite,2,1
143282,201501270013,2015,1,27,Philippines,Southeast Asia,Maguindanao,Pagalungan,7.1417850000000005,124.382019,"01/27/2015: An explosive device was discovered and safely defused at a National Grid Corporation of the Philippines (NGCP) transmission tower in Pagalungan town, Maguindanao province, Philippines. No group claimed responsibility for the incident.",Utilities,Unknown,Explosives/Bombs/Dynamite,0,0
143301,201501270035,2015,1,27,Philippines,Southeast Asia,Negros Occidental,Hacienda Cabiguan,10.071629,122.84740500000001,"01/27/2015: Assailants attacked a Uni-Starch Incorporated plant site in Hacienda Cabiguan area, Negros Occidental province, Philippines. There were no reported casualties; however, equipment was damaged in the attack. The New People's Army (NPA) claimed responsibility for the incident; however, sources doubted the veracity of this claim.",Business,New People's Army (NPA),Incendiary,0,0
143316,201501270061,2015,1,27,Philippines,Southeast Asia,Bukidnon,Santa Filomena,7.709312,125.222853,"01/27/2015: An explosive device detonated near a military patrol in Santa Filomena village, Bukidnon province, Philippines. One soldier was killed and five others were wounded in the blast. No group claimed responsibility for the incident.",Military,Unknown,Explosives/Bombs/Dynamite,1,5
143322,201501270068,2015,1,27,Philippines,Southeast Asia,Bulacan,Meycauayan,14.733545999999999,120.96094699999999,"01/27/2015: Assailants opened fire on Rey Rivera in Calvario neighborhood, Meycauayan city, Bulacan province, Philippines. Rivera, the city's assistant engineer, was killed in the attack. No group claimed responsibility for the incident.",Government (General),Unknown,Firearms,1,0
143347,201501280029,2015,1,28,Philippines,Southeast Asia,Davao del Sur,Paquibato,7.321781,125.462678,"01/28/2015: Assailants opened fire on military personnel in Paquibato village, Davao del Sur province, Philippines. A soldier was killed and one other was injured in the attack. No group claimed responsibility for the incident; however, sources attributed the attack to the New People's Army (NPA).",Military,New People's Army (NPA),Firearms,1,1
143354,201501280037,2015,1,28,Philippines,Southeast Asia,Basilan,Al-Barka,6.491326,122.14344299999999,"01/28/2015: An explosive device detonated near a backhoe in Al-Barka town, Basilan province, Philippines. There were no reported casualties, although the backhoe was damaged in the blast. No group claimed responsibility for the incident; however, sources suspected that the Abu Sayyaf Group (ASG) was involved in the attack.",Business,Abu Sayyaf Group (ASG),Explosives/Bombs/Dynamite,0,0
143447,201501300046,2015,1,30,Philippines,Southeast Asia,Basilan,Limbocandis,6.441898,121.963071,"01/30/2015: Assailants opened fire on a Citizen Armed Forces Geographical Unit (CAFGU) patrol near a government project site in Limbocandis village, Sumisip town, Basilan province, Philippines. Three civilians were injured in the ensuing clash. No group claimed responsibility for the incident; however, sources suspected the involvement of the Abu Sayyaf Group (ASG).",Military,Abu Sayyaf Group (ASG),Firearms,0,3
143448,201501300047,2015,1,30,Philippines,Southeast Asia,Sulu,Panding,6.030844999999999,121.046407,"01/30/2015: Assailants opened fire on a military convoy in Sitio Panding area, Bungkaong village, Patikul town, Sulu province, Philippines. At least two soldiers were injured in the attack. No group claimed responsibility; however, sources attributed the incident to the Abu Sayyaf Group (ASG).",Military,Abu Sayyaf Group (ASG),Firearms,0,2
143449,201501300048,2015,1,30,Philippines,Southeast Asia,Basilan,Limbocandis,6.441898,121.963071,"01/30/2015: An explosive device detonated after it was stepped on by a civilian in Limbocandis village, Sumisip town, Basilan province, Philippines. A civilian, identified as Mannah Jallama, was killed and another, identified as Sopia Abduhu, was injured in the blast. No group claimed responsibility for the incident.",Private Citizens & Property,Unknown,Explosives/Bombs/Dynamite,1,1
143487,201501300098,2015,1,30,Philippines,Southeast Asia,Metropolitan Manila,Manila,14.606842000000002,120.975894,"01/30/2015: A grenade detonated in Barangay 266 area, Manila city, Metropolitan Manila province, Philippines. There were no reported casualties in the blast. A second grenade was discovered and safely defused following the attack. No group claimed responsibility for the incident.",Unknown,Unknown,Explosives/Bombs/Dynamite,0,0
143488,201501300099,2015,1,30,Philippines,Southeast Asia,Maguindanao,Datu Odin Sinsuat,7.183503999999999,124.21271399999999,"01/30/2015: An assailant fired a rocket at a vehicle parked at a university in Datu Odin Sinsuat town, Maguindanao province, Philippines. No one was injured in the attack, but the vehicle was destroyed. No group claimed responsibility for the incident.",Private Citizens & Property,Unknown,Explosives/Bombs/Dynamite,0,0
143489,201501300100,2015,1,30,Philippines,Southeast Asia,Maguindanao,Datu Saudi Ampatuan,6.955153999999999,124.44659899999999,"01/30/2015: A grenade detonated in Datu Saudi Ampatuan town, Maguindanao province, Philippines. No further information was available.",Unknown,Unknown,Explosives/Bombs/Dynamite,0,0
143499,201501310010,2015,2,1,Philippines,Southeast Asia,Cavite,Datu Sultan Ismael,14.299370000000001,120.95735900000001,"02/01/2015: Assailants opened fire on civilians at a barangay hall in Datu Sultan Ismael village, Dasmarinas municipality, Cavite province, Philippines. A barangay administrator and two other people were killed and one person was injured in the attack. No group claimed responsibility for the incident.",Government (General),Unknown,Firearms,3,1
143529,201501310043,2015,1,31,Philippines,Southeast Asia,Quezon,Binahian C,13.795152999999999,122.25196299999999,"01/31/2015: Assailants attacked two Philippine Army (PA) soldiers in Binahian-C village, Quezon province, Philippines. The soldiers were killed in the attack. The Apolonio Mendoza Command (AMC) of the New People's Army (NPA) claimed responsibility for the incident, stating that the victims were former rebels.",Military,New People's Army (NPA),Firearms,2,0
143587,201502010133,2015,2,1,Philippines,Southeast Asia,Sorsogon,Santa Lourde,12.824688,124.088357,"02/01/2015: Three explosive devices were discovered and defused in Sitio Bagong Barrio area, Santa Lourde village, Barcelona town, Sorsogon province, Philippines. No group claimed responsibility for the incident; however, a military official attributed the attempted attack to the New People's Army (NPA).",Unknown,New People's Army (NPA),Explosives/Bombs/Dynamite,0,0
