,id,year,month,day,country,region,state,city,latitude,longitude,summary,target,tgroup,weapon,fatalities,injuries
154041,201510180037,2015,10,18,Philippines,Southeast Asia,Maguindanao,Cotabato City,7.216646000000001,124.250054,"10/18/2015: Assailants attacked a military intelligence official and his companion on the outskirts of Cotabato city, Maguindanao province, Philippines. The intelligence official was killed and his companion was wounded in the attack. No group claimed responsibility for the incident; however, sources attributed the attack to the Bangsamoro Islamic Freedom Movement (BIFM).",Military,Bangsamoro Islamic Freedom Movement (BIFM),Firearms,1,1
154047,201510180046,2015,10,18,Philippines,Southeast Asia,North Cotabato,Carmen district,7.382613,124.81825900000001,"10/18/2015: Three explosive devices attached to a steel tower of the National Grid Corporation were discovered and safely defused in Carmen district, North Cotabato province, Philippines. No group claimed responsibility for the incident.",Utilities,Unknown,Explosives/Bombs/Dynamite,0,0
154068,201510180079,2015,10,18,Philippines,Southeast Asia,Zamboanga Sibugay,Lower Tungawan,7.590152000000001,122.40141899999999,"10/18/2015: An assailant threw a grenade at Doque Basa, a soldier, and Boyet Liozo, a civilian in Lower Tungawan village, Zamboanga Sibugay province, Philippines. There were no reported casualties in the blast. No group claimed responsibility for the incident; however, sources identified the assailant as Sahid Yusop.",Military,Unknown,Explosives/Bombs/Dynamite,0,0
154076,201510190002,2015,10,19,Philippines,Southeast Asia,Agusan del Norte,Butuan,8.952956,125.54746000000002,"10/19/2015: Assailants abducted Dario Otaza and his son from their residence in Baan neighborhood, Butuan City, Agusan del Norte province, Philippines. Otaza, the mayor of Lareto town and a former New People's Army (NPA) member, and his son were killed and their bodies were discovered on October 20, 2015. The New People's Army (NPA) claimed responsibility for the incident and stated that the victims were targeted for their alleged human rights violations.",Government (General),New People's Army (NPA),Firearms,2,0
154113,201510190054,2015,10,19,Philippines,Southeast Asia,North Cotabato,Imamaling,7.104686999999999,125.124449,"10/19/2015: Assailants opened fire on Marco Engay Vea in Imamaling village, Magpet district, North Cotabato province, Philippines. Vea, a former New People's Army member, was killed and a civilian was injured in the attack. No group claimed responsibility for the incident; however, sources attributed the attack to the New People's Army (NPA).",Private Citizens & Property,New People's Army (NPA),Firearms,1,1
154123,201510200012,2015,10,20,Philippines,Southeast Asia,Maguindanao,Sambolawan,6.908157000000001,124.550297,"10/20/2015: Assailants fired two projectiles at a Philippine Army (PA) base in Sambolawan village, Datu Salibo district, Maguindanao province, Philippines. At least two assailants were wounded in the ensuing clash. No group claimed responsibility; however, sources suspected that the attack was carried out by the Bangsamoro Islamic Freedom Movement (BIFM), which denied involvement.",Military,Bangsamoro Islamic Freedom Movement (BIFM),Explosives/Bombs/Dynamite,0,2
154158,201510210003,2015,10,21,Philippines,Southeast Asia,Davao del Sur,Gumalang,7.216311,125.395845,"10/21/2015: Assailants set fire to five pieces of construction equipment from Alsons Construction in Gumalang village, Davao del Sur province, Philippines. There were no reported casualties in the attack. This was one of two incidents targeting construction sites in Davao del Sur overnight. No group claimed responsibility; however, sources attributed the attacks to the New People's Army (NPA).",Business,New People's Army (NPA),Incendiary,0,0
154159,201510210004,2015,10,22,Philippines,Southeast Asia,Davao del Sur,Lower Tamugan,7.243817999999999,125.382279,"10/22/2015: Assailants set fire to three pieces of construction equipment from Alsons Construction in Lower Tamugan village, Marilog district, Davao del Sur province, Philippines. There were no reported casualties in the attack. This was one of two incidents targeting construction sites in Davao del Sur overnight. No group claimed responsibility; however, sources attributed the attacks to the New People's Army (NPA).",Business,New People's Army (NPA),Incendiary,0,0
154162,201510210013,2015,10,21,Philippines,Southeast Asia,Sulu,Sandah,6.063023,121.102294,"10/21/2015: Assailants opened fire on Barangay Peacekeeping Action Team (BPAT) officers in Sandah village, Patikul district, Sulu province, Philippines. At least one civilian was wounded in the assault. No group claimed responsibility; however, sources attributed the attack to the Abu Sayyaf Group (ASG).",Police,Abu Sayyaf Group (ASG),Firearms,0,1
154163,201510210014,2015,10,21,Philippines,Southeast Asia,Basilan,Limbocandis,6.4406930000000004,121.958729,"10/21/2015: Assailants opened fire on a Philippine Army (PA) soldier traveling with two civilians in Limbocandis village, Sumisip district, Basilan province, Philippines. The soldier was killed and an unknown number of assailants were killed or wounded in the assault. No group claimed responsibility; however, sources attributed the attack to the Abu Sayyaf Group (ASG).",Military,Abu Sayyaf Group (ASG),Firearms,1,0
154188,201510210064,2015,10,21,Philippines,Southeast Asia,Sorsogon,Tinago,12.850032,123.98328000000001,"10/21/2015: Assailants opened fire on Philippine Army (PA) soldiers in Tinago, Juban district, Sorsogon province, Philippines. An explosive devices also detonated during the assault. At least three assailants were killed and two soldiers were injured in the attack. No group claimed responsibility; however, sources attributed the incident to the New People's Army (NPA).",Military,New People's Army (NPA),Explosives/Bombs/Dynamite,3,2
154189,201510210067,2015,10,21,Philippines,Southeast Asia,North Cotabato,Tacupan,7.208375,124.795397,"10/21/2015: Three explosive devices were discovered and defused underneath a National Grid Corporation of the Philippines (NGCP) power tower in Tacupan neighborhood, Carmen city, North Cotabato province, Philippines. No group claimed responsibility for the attack.",Utilities,Unknown,Explosives/Bombs/Dynamite,0,0
154250,201510230061,2015,10,23,Philippines,Southeast Asia,Samar,Caugbasan,12.016832,124.816499,"10/23/2015: Assailants opened fire on a boat transporting local councilors and civilians in Caugbasan village, Gandara district, Samar province, Philippines. At least four people were killed and another person was injured in the assault. No group claimed responsibility for the attack.",Government (General),Unknown,Firearms,4,1
154329,201510250079,2015,10,25,Philippines,Southeast Asia,Maguindanao,Linantangan,6.930046000000001,124.487183,"10/25/2015: Assailants fired a grenade at a military detachment in Linantangan village, Mamasapano district, Maguindanao province, Philippines. At least three soldiers were injured in the blast. No group claimed responsibility for the incident; however, sources attributed the attack to the Bangsamoro Islamic Freedom Movement (BIFM).",Military,Bangsamoro Islamic Freedom Movement (BIFM),Explosives/Bombs/Dynamite,0,3
154337,201510260004,2015,10,26,Philippines,Southeast Asia,North Cotabato,Luna Sur,6.954822999999999,125.09399099999999,"10/26/2015: Twenty assailants opened fire on a military detachment in Luna Sur village, North Cotabato province, Philippines. There were no reported casualties. This was one of two related attacks in Luna Sur village on this date. No group claimed responsibility for the incidents; however, sources attributed the attacks to the New People's Army (NPA).",Military,New People's Army (NPA),Firearms,0,0
154338,201510260005,2015,10,26,Philippines,Southeast Asia,North Cotabato,Luna Sur,6.954822999999999,125.09399099999999,"10/26/2015: Assailants attacked a Dole Stanfilco plantation in Luna Sur village, North Cotabato province, Philippines. There were no reported casualties, although two trucks were torched during the attack. This was one of two related attacks in Luna Sur village on this date. No group claimed responsibility for the incidents; however, sources attributed the attack to the New People's Army (NPA).",Business,New People's Army (NPA),Firearms,0,0
154344,201510260011,2015,10,26,Philippines,Southeast Asia,Basilan,Lamitan,6.649966,122.133527,"10/26/2015: An explosive device was discovered and defused along Rizal Avenue in Lamitan city, Basilan province, Philippines. No group claimed responsibility; however, authorities attributed the attack to the Abu Sayyaf Group (ASG).",Unknown,Abu Sayyaf Group (ASG),Explosives/Bombs/Dynamite,0,0
154376,201510270003,2015,10,27,Philippines,Southeast Asia,Sulu,Latih,6.037483,121.031254,"10/27/2015: An explosive device detonated in Sitio Halaw area, Latih village, Sulu province, Philippines. There were no reported casualties in the blast. No group claimed responsibility for the incident; however, sources attributed the attack to the Abu Sayyaf Group (ASG).",Military,Abu Sayyaf Group (ASG),Explosives/Bombs/Dynamite,0,0
154377,201510270004,2015,10,27,Philippines,Southeast Asia,Catanduanes,Obi,13.819335,124.175444,"10/27/2015: Assailants opened fire on Wedihenyo Gonzales in Obi village, Caramoran district, Catanduanes province, Philippines. Gonzales, a suspected informant, was killed in the attack. No group claimed responsibility for the incident; however, sources attributed the attack to the New People's Army (NPA).",Private Citizens & Property,New People's Army (NPA),Firearms,1,0
154414,201510270101,2015,10,27,Philippines,Southeast Asia,Sulu,Latih,6.0371690000000005,121.030406,"10/27/2015: An explosive device detonated prematurely as assailants were planting it in Latih village, Patikul district, Sulu province, Philippines. There were no reported casualties in the attack. No group claimed responsibility for the incident; however, sources attributed the attack to the Abu Sayyaf Group (ASG).",Unknown,Abu Sayyaf Group (ASG),Explosives/Bombs/Dynamite,0,0
154420,201510280003,2015,10,28,Philippines,Southeast Asia,Isabela,Dimaluade,16.695954999999998,122.220008,"10/28/2015: Thirty assailants attacked a Geogen-Nickel Asia Mining Corporation mining compound in Dimaluade village, Dinapigue town, Isabela province, Philippines. There were no reported casualties, although vehicles and mining equipment were torched during the attack. The New People's Army (NPA) claimed responsibility for the incident and stated that the attack was carried out in retaliation for the mining site's precarious activities and the company's refusal to pay an extortion.",Business,New People's Army (NPA),Firearms,0,0
154421,201510280006,2015,10,28,Philippines,Southeast Asia,Camarines Norte,San Felipe,14.066108999999999,122.964542,"10/28/2015: Assailants opened fire on a Civilian Active Auxiliary (CAA) camp in San Felipe village, Basud town, Camarines Norte province, Philippines. There were no reported casualties in the attack. No group claimed responsibility for the incident; however, sources attributed the attack to the New People's Army (NPA).",Military,New People's Army (NPA),Explosives/Bombs/Dynamite,0,0
154469,201510290015,2015,10,29,Philippines,Southeast Asia,Lanao del Sur,Marawi,8.000249,124.29986000000001,"10/29/2015: A homemade explosive device detonated targeting a National Grid Corporation of the Philippines (NGCP) electricity tower in Patani village, Marawi city, Lanao del Sur province, Philippines. There were no reported casualties. This was one of two related bombings targeting electricity towers in Patani on this date. No group claimed responsibility for the incidents.",Utilities,Unknown,Explosives/Bombs/Dynamite,0,0
154498,201510290063,2015,10,29,Philippines,Southeast Asia,Lanao del Sur,Marawi,8.000249,124.29986000000001,"10/29/2015: A homemade explosive device detonated targeting a National Grid Corporation of the Philippines (NGCP) electricity tower in Patani village, Marawi city, Lanao del Sur province, Philippines. There were no reported casualties. This was one of two related bombings targeting electricity towers in Patani on this date. No group claimed responsibility for the incidents.",Utilities,Unknown,Explosives/Bombs/Dynamite,0,0
154557,201510310002,2015,10,31,Philippines,Southeast Asia,Camarines Sur,Pag-oring Nuevo,13.700002,123.066383,"10/31/2015: Assailants shot and killed a soldier at a store in Pag-oring Nuevo village, Libmanan district, Camarines Sur province, Philippines. No group claimed responsibility for the incident; however, sources attributed the attack to the New People's Army (NPA).",Military,New People's Army (NPA),Firearms,1,0
154558,201510310003,2015,10,31,Philippines,Southeast Asia,Camarines Norte,Daguit,14.152848,122.672946,"10/31/2015: Assailants attacked the Namukanan bridge project in Daguit village, Labo district, Camarines Sur province, Philippines. At least two assailants were killed and one soldier was injured in the ensuing clash. No group claimed responsibility; however, sources attributed the incident to the New People's Army (NPA).",Business,New People's Army (NPA),Firearms,2,1
154559,201510310004,2015,10,31,Philippines,Southeast Asia,Albay,Cuyaoyao,13.035417,123.447825,"10/31/2015: Assailants opened fire on a military detachment in Cuyaoyao Village, Pio Duran district, Albay province, Philippines. There were no reported casualties in the attack. No group claimed responsibility for the incident; however, sources attributed the attack to the New People's Army (NPA).",Military,New People's Army (NPA),Explosives/Bombs/Dynamite,0,0
154575,201510310025,2015,10,31,Philippines,Southeast Asia,Sulu,Jolo,6.047402,121.008959,"10/31/2015: An explosive device was discovered and defused at Mount Carmel Cemetery in Jolo city, Sulu province, Philippines. No group claimed responsibility for the attack.",Private Citizens & Property,Unknown,Explosives/Bombs/Dynamite,0,0
154585,201510310038,2015,10,31,Philippines,Southeast Asia,Quezon,Catablingan,14.771730999999999,121.3387,"10/31/2015: Three assailants opened fire on a vehicle driven by Eliseo Rozul in Catablingan, General Nakar district, Quezon province, Philippines. Rozul, a mayoral candidate, was injured in the attack. No group claimed responsibility for the attack.",Private Citizens & Property,Unknown,Firearms,0,1
154595,201510310061,2015,10,31,Philippines,Southeast Asia,Metropolitan Manila,Quezon City,14.676041,121.042749,"10/31/2015: Assailant shot and killed Jose Bernardo, a radio journalist, in Quezon City, Metropolitan Manila, Philippines. No group claimed responsibility for the incident.",Journalists & Media,Unknown,Firearms,1,0
154608,201511010001,2015,11,1,Philippines,Southeast Asia,Sarangani,Upper Suyan,5.966542,125.28556499999999,"11/01/2015: Assailants attacked military engineers working on building a school in Upper Suyan village, Malapatan municipality, Sarangani province, Philippines. There were no reported casualties in the attack. No group claimed responsibility; however, sources attributed the incident to the New People's Army (NPA).",Military,New People's Army (NPA),Firearms,0,0
154609,201511010002,2015,11,1,Philippines,Southeast Asia,Davao del Sur,Sumimao,7.27733,125.489147,"11/01/2015: Assailants opened fire on a Citizens Armed Forces Geographical Unit (CAFGU) patrol base in Sitio Ipil area, Sumimao village, Paquibato district, Davao del Sur province, Philippines. There were no reported casualties in the attack. No group claimed responsibility for the incident; however, sources attributed the attack to the New People's Army (NPA)'s Southern Mindanao Regional Command (SMRC).",Military,New People's Army (NPA),Firearms,0,0
154610,201511010003,2015,11,1,Philippines,Southeast Asia,Masbate,Dayao,12.233896000000001,123.28291200000001,"11/01/2015: An assailant threw a hand grenade at a village hall in Dayao village, Mandaon municipality, Masbate province, Philippines. There were no reported casualties in the attack. No group claimed responsibility for the incident.",Government (General),Unknown,Explosives/Bombs/Dynamite,0,0
154648,201511020001,2015,11,2,Philippines,Southeast Asia,Sorsogon,Gubat,12.920444,124.12286599999999,"11/02/2015: Assailants attacked police officers in Gubat municipality, Sorsogon province, Philippines. Five police officers were wounded in the attack. No group claimed responsibility; however, sources attributed the incident to the New People's Army (NPA).",Police,New People's Army (NPA),Firearms,0,5
154731,201511040030,2015,11,4,Philippines,Southeast Asia,Bukidnon,White Kulaman,7.633731,125.016428,"11/04/2015: Assailants abducted three civilians from White Kulaman village, Kitaotao town, Bukidnon province, Philippines. The hostages were safely released only hours after the kidnapping. No group claimed responsibility for the incident; however, sources attributed the abduction to the New People's Army (NPA).",Private Citizens & Property,New People's Army (NPA),Unknown,0,0
154735,201511040035,2015,11,4,Philippines,Southeast Asia,Cebu,Tabunok,10.257972,123.848826,"11/04/2015: Assailants opened fire on Gerardo Campo in Rabaya Street area, Nonoc neighborhood, Tabunok village, Talisay district, Cebu province, Philippines. Campo, a customs official, was unharmed; however, his driver was wounded in the attack. No group claimed responsibility for the incident.",Government (General),Unknown,Firearms,0,1
154761,201511050028,2015,11,5,Philippines,Southeast Asia,Surigao del Sur,Santa Juana,8.457594,126.157642,"11/05/2015: Ten assailants set fire to a logging truck in Santa Juana village, Tagbina district, Surigao del Sur province, Philippines. There were no reported casualties, but the truck was damaged. No group claimed responsibility for the incident; however, sources attributed the attack to the New People's Army (NPA).",Business,New People's Army (NPA),Incendiary,0,0
154804,201511060034,2015,11,6,Philippines,Southeast Asia,Lanao del Sur,Matampay,8.011382000000001,124.28528899999999,"11/06/2015: An explosive device detonated at a National Grid Corporation of the Philippines (NGCP) transmission tower in Kurmatan area, Matampay village, Lanao del Sur province, Philippines. There were no reported casualties, but the tower was damaged in the blast. No group claimed responsibility for the incident.",Utilities,Unknown,Explosives/Bombs/Dynamite,0,0
154816,201511060047,2015,11,6,Philippines,Southeast Asia,Sarangani,Malapatan district,5.966235,125.28526200000002,"11/06/2015: An explosive device detonated targeting an army patrol in Malapatan district, Sarangani province, Philippines. One soldier was killed and five soldiers were injured in the attack. No group claimed responsibility for the incident; however, sources attributed the attack to the New People's Army (NPA).",Military,New People's Army (NPA),Explosives/Bombs/Dynamite,1,5
154875,201511080054,2015,11,8,Philippines,Southeast Asia,Negros Occidental,San Isidro,10.372086,122.8682,"11/08/2015: Assailants opened fire on Nelbert Esguiran in Hacienda Santa Ana area, San Isidro village, Negros Occidental province, Philippines. Esguiran, president of the United Canlusong Upland Reforestation and Development, was killed and one other person was wounded in the attack. No group claimed responsibility for the incident.",Government (General),Unknown,Firearms,1,1
154879,201511080062,2015,11,8,Philippines,Southeast Asia,Basilan,Campo Dos,6.64982,122.133453,"11/08/2015: Assailants opened fire on military personnel in Campo Dos village, Lamitan city, Basilan province, Philippines. Three assailants were killed and three soldiers were injured in the ensuing clash. No group claimed responsibility for the incident; however, sources attributed the attack to the Urban Terrorist Group (UTG) of the Abu Sayyaf Group (ASG).",Military,Abu Sayyaf Group (ASG),Firearms,3,3
154882,201511080066,2015,11,8,Philippines,Southeast Asia,Iloilo,Iloilo,10.694875,122.542728,"11/08/2015: Assailants opened fire on Raymund Valera in Molo area, Iloilo City, Iloilo province, Philippines. Valera, an election officer, was killed in the attack. No group claimed responsibility for the incident.",Government (General),Unknown,Firearms,1,0
154941,201511100015,2015,11,10,Philippines,Southeast Asia,Davao del Sur,Daliao,7.012594,125.506754,"11/10/2015: Assailants abducted 11 government water project workers from Daliao village, Davao del Sur province, Philippines. The hostages were released on November 11, 2015. Additionally, several pieces of heavy equipment were set ablaze during the attack. No group claimed responsibility for the incident; however, sources attributed the abduction to Guerrilla Front 54 of the New People's Army (NPA).",Government (General),New People's Army (NPA),Incendiary,0,0
154945,201511100019,2015,11,10,Philippines,Southeast Asia,Camarines Sur,Guijalo,13.736638000000001,123.869033,"11/10/2015: Assailants attacked a Philippine Coast Guard (PCG) detachment in Guijalo village, Camarines Sur province, Philippines. There were no reported casualties, although weapons and other military equipment were stolen during the attack. No group claimed responsibility for the incident; however, sources attributed the attack to the New People's Army (NPA).",Police,New People's Army (NPA),Firearms,0,0
154984,201511110014,2015,11,11,Philippines,Southeast Asia,North Cotabato,Kayaga,7.11412,124.808899,"11/11/2015: Assailants threw a grenade near a Community Police Assistance Center (COMPAC) in Kayaga village, Kabacan town, North Cotabato province, Philippines. A civilian was injured in the blast. No group claimed responsibility for the incident.",Private Citizens & Property,Unknown,Explosives/Bombs/Dynamite,0,1
155009,201511110060,2015,11,11,Philippines,Southeast Asia,South Cotabato,Poblacion,6.335757,124.774079,"11/11/2015: Assailants opened fire on Imam Abdulkadir Sumael in Poblacion village, Purok Islam area, South Cotabato province, Philippines. The imam was killed in the attack. No group claimed responsibility for the incident.",Religious Figures/Institutions,Unknown,Firearms,1,0
155012,201511110066,2015,11,11,Philippines,Southeast Asia,Palawan,Tarusan,8.656259,117.510498,"11/11/2015: Assailants opened fire on the convoy of Abraham Ibba in Tarusan village, Bataraza municipality, Palawan province, Philippines. At least two people including Ibba, a former mayor, current board member, and future mayoral candidate, were injured in the assault. No group claimed responsibility for the attack.",Government (General),Unknown,Firearms,0,2
155014,201511110068,2015,11,11,Philippines,Southeast Asia,Ilocos Norte,Calungbuyan,17.937248,120.640965,"11/11/2015: Assailants opened fire on Conrado Oligo Agtarap in Calungbuyan village, Ilocos Norte province, Philippines. Agtarap, a Partido ng Bagong Maharlika town councilor candidate, was killed in the attack. No group claimed responsibility for the incident.",Private Citizens & Property,Unknown,Firearms,1,0
155044,201511120058,2015,11,12,Philippines,Southeast Asia,Agusan del Sur,Sibagat district,8.822313000000001,125.69331799999999,"11/12/2015: Assailants set fire to an Alternative Learning Center for Agriculture and Development (ALCADEV) in Sibagat municipality, Agusan del Sur province, Philippines. There were no reported casualties, but the building was damaged in the attack. No group claimed responsibility; however, sources attributed the incident to the New People's Army (NPA).",Educational Institution,New People's Army (NPA),Incendiary,0,0
155089,201511130055,2015,11,13,Philippines,Southeast Asia,Maguindanao,Shariff Aguak,6.864685000000001,124.44175600000001,"11/13/2015: Thirty armed assailants attacked a military base in Shariff Aguak city, Maguindanao province, Philippines. There were no reported casualties in the attack. No group claimed responsibility for the attack; however, sources attributed it to the Bangsamoro Freedom Movement (BIFM).",Military,Bangsamoro Islamic Freedom Movement (BIFM),Firearms,0,0
155096,201511130068,2015,11,13,Philippines,Southeast Asia,Isabela,Santiago district,16.715581,121.553653,"11/13/2015: Assailants opened fire on Martin Banguin in Santiago City, Isabela province, Philippines. Bangui, an employee of the Department of the Interior and Local Government, and a student were wounded in the attack. No group claimed responsibility for the incident.",Government (General),Unknown,Firearms,0,2
155104,201511140006,2015,11,14,Philippines,Southeast Asia,Maguindanao,Cotabato City,7.216734,124.249974,"11/14/2015: Assailants fired a rifle grenade at a Cotabato Light and Power Company compound in Cotabato City, Maguindanao province, Philippines. There were no reported casualties in the blast. This was one of two related attacks that occurred in Cotabato City on this date. The Bangsamoro Islamic Freedom Movement (BIFM) claimed responsibility for the incidents; however, a military official disputed the claim.",Utilities,Bangsamoro Islamic Freedom Movement (BIFM),Explosives/Bombs/Dynamite,0,0
155105,201511140007,2015,11,14,Philippines,Southeast Asia,Maguindanao,Cotabato City,7.199553,124.23738,"11/14/2015: Assailants fired a rifle grenade at a military patrol on Sinsuat Avenue in Cotabato City, Maguindanao province, Philippines. At least three people, including two soldiers and one civilian, were injured in the blast. This was one of two related attacks in Cotabato City on this date. The Bangsamoro Islamic Freedom Movement (BIFM) claimed responsibility for the incidents; however, a military official disputed the claim.",Military,Bangsamoro Islamic Freedom Movement (BIFM),Explosives/Bombs/Dynamite,0,3
