,id,year,month,day,country,region,state,city,latitude,longitude,summary,target,tgroup,weapon,fatalities,injuries
149248,201506180097,2015,6,18,Philippines,Southeast Asia,Maguindanao,Shariff Saydona Mustapha,6.942258,124.419824,"06/18/2015: Assailants opened fire on a civilian vehicle in Pamalian area, Shariff Saydona Mustapha town, Maguindanao province, Philippines. Four people were killed in the attack. No group claimed responsibility for the incident; however, sources attributed the attack to the Bangsamoro Islamic Freedom Movement (BIFM).",Private Citizens & Property,Bangsamoro Islamic Freedom Movement (BIFM),Firearms,4,0
149255,201506190017,2015,6,19,Philippines,Southeast Asia,Davao del Sur,Sinoron,7.074433999999999,125.586157,"06/19/2015: Assailants opened fire on a military patrol in Sinoron village, Davao del Sur province, Philippines. A soldier was killed and six others, including four assailants and two soldiers, were injured in the ensuing clash. No group claimed responsibility for the incident; however, sources attributed the attack to the New People's Army (NPA).",Military,New People's Army (NPA),Explosives/Bombs/Dynamite,1,6
149256,201506190018,2015,6,19,Philippines,Southeast Asia,Davao del Norte,Dagohoy,7.734803,125.512622,"06/19/2015: Assailants attacked the Serbisyo Caravan in Tibucag area, Dagohoy village, Davao del Norte province, Philippines. No casualties were reported. No group claimed responsibility for the incident; however, a source attributed the attack to the New People's Army (NPA).",Private Citizens & Property,New People's Army (NPA),Firearms,0,0
149266,201506190033,2015,6,19,Philippines,Southeast Asia,Isabela,Centro,17.000813,121.825905,"06/19/2015: Assailants opened fire on municipal employees in the town hall in Centro area, Isabela province, Philippines. Vice Mayor Florante Raspado and one other person were killed in the attack. No group claimed responsibility for the incident.",Government (General),Unknown,Firearms,2,0
149285,201506200017,2015,6,20,Philippines,Southeast Asia,Sorsogon,Culasi,11.433122000000001,122.106467,"06/20/2015: Assailants opened fire on civilians at a shop in Culasi village, Sorsogon province, Philippines. One civilian was killed in the attack. No group claimed responsibility for the incident; however, sources attributed the attack to the New People's Army (NPA).",Private Citizens & Property,New People's Army (NPA),Firearms,1,0
149300,201506200091,2015,6,20,Philippines,Southeast Asia,Maguindanao,Datu Piang,7.02775,124.50280900000001,"06/20/2015: Assailants attacked three soldiers in a market in Datu Piang municipality, Maguindanao province, Philippines. One soldier was killed and two others were wounded in the attack. No group claimed responsibility for the incident; however, sources attributed the attack to the Bangsamoro Islamic Freedom Movement (BIFM).",Military,Bangsamoro Islamic Freedom Movement (BIFM),Firearms,1,2
149332,201506210058,2015,6,21,Philippines,Southeast Asia,Compostela Valley,Unknown,7.512515,126.17626200000001,"06/21/2015: Assailants opened fire on a military base in Compostela Valley province, Philippines. One civilian was wounded when a nearby residence was hit. No group claimed responsibility for the incident; however, military sources attributed the attack to the New People's Army (NPA).",Military,New People's Army (NPA),Firearms,0,1
149350,201506220020,2015,6,22,Philippines,Southeast Asia,Maguindanao,Datu Unsay district,6.912223,124.453097,"06/22/2015: Assailants opened fire on soldiers in Datu Unsay district, Maguindanao province, Philippines. Two soldiers were killed in the attack. The Bangsamoro Islamic Freedom Movement (BIFM) claimed responsibility for the incident.",Military,Bangsamoro Islamic Freedom Movement (BIFM),Firearms,2,0
149370,201506220045,2015,6,22,Philippines,Southeast Asia,Iloilo,Oton,10.724419000000001,122.455092,"06/22/2015: Assailants opened fire on a village council member in barangay San Antonio, Oton area, Iloilo province, Philippines. The council member was killed in the attack. No group claimed responsibility for the incident.",Government (General),Unknown,Firearms,1,0
149382,201506220094,2015,6,22,Philippines,Southeast Asia,Maguindanao,Salbu,6.926258,124.41501399999999,"06/22/2015: Assailants attacked two individuals, including a police officer, inside a van in Salbu town, Maguindanao province, Philippines. There were no reported casualties. No group claimed responsibility for the incident; however, sources attributed the attack to the Bangsamoro Islamic Freedom Movement (BIFM).",Police,Bangsamoro Islamic Freedom Movement (BIFM),Unknown,0,0
149398,201506230028,2015,6,23,Philippines,Southeast Asia,Basilan,Sapa Bulak,6.563592,122.116863,"06/23/2015: An explosive device detonated near a military patrol in Bohe Manicaan area, Sapa Bulak village, Basilan province, Philippines. Two soldiers were killed and one other was injured in the blast. No group claimed responsibility for the incident; however, sources attributed the attack to the Abu Sayyaf Group (ASG).",Military,Abu Sayyaf Group (ASG),Explosives/Bombs/Dynamite,2,1
149399,201506230029,2015,6,23,Philippines,Southeast Asia,Basilan,Tipo-Tipo,6.536668,122.16723600000002,"06/23/2015: An explosive device detonated near a military patrol in Tipo-Tipo village, Basilan province, Philippines. Two soldiers were injured in the attack. No group claimed responsibility for the incident; however, sources attributed the attack to the Abu Sayyaf Group (ASG).",Military,Abu Sayyaf Group (ASG),Explosives/Bombs/Dynamite,0,2
149400,201506230030,2015,6,23,Philippines,Southeast Asia,Basilan,Lamitan,6.660017999999999,122.1412,"06/23/2015: An explosive device detonated at M. Lhuillier Pawnshop in Lamitan city, Basilan province, Philippines. There were no reported casualties in the blast. No group claimed responsibility for the incident; however, sources attributed the attack to the Abu Sayyaf Group (ASG).",Business,Abu Sayyaf Group (ASG),Explosives/Bombs/Dynamite,0,0
149433,201506240021,2015,6,25,Philippines,Southeast Asia,Mountain,Butigue,17.156221,121.49131799999999,"06/25/2015: Assailants opened fire on Corporal Felix M. Pico. in Butigue village, Mountain, Philippines. Pico, a soldier, was killed in the attack. No group claimed responsibility for the incident; however, sources attributed the attack to the New People's Army (NPA).",Military,New People's Army (NPA),Firearms,1,0
149438,201506240031,2015,6,24,Philippines,Southeast Asia,La Union,Bacnotan district,16.729937,120.36859199999999,"06/24/2015: An assailant opened fire on Edwin Cua in Bacnotan district, La Union province, Philippines. Cua, a village chairperson, was killed in the attack. No group claimed responsibility for the incident.",Government (General),Unknown,Firearms,1,0
149442,201506240044,2015,6,24,Philippines,Southeast Asia,Capiz,Manayupit,11.390865,122.648119,"06/24/2015: Assailants opened fire on military personnel in Manayupit village, Capiz province, Philippines. There were no reported casualties in the attack. No group claimed responsibility for the incident; however, sources attributed the attack to the New People's Army (NPA).",Military,New People's Army (NPA),Firearms,0,0
149465,201506250018,2015,6,25,Philippines,Southeast Asia,Cavite,Pinagbuklod,14.394604999999999,120.96518300000001,"06/25/2015: Assailants opened fire on Jonathan Oldan at a convenience store in Pinagbuklod village, Cavite province, Philippines. Oldan, a CNN Philippines employee, was killed in the attack. No group claimed responsibility for the incident.",Journalists & Media,Unknown,Firearms,1,0
149567,201506280039,2015,6,28,Philippines,Southeast Asia,Sorsogon,Burabod,12.934550999999999,123.781102,"06/28/2015: Assailants opened fire on a Community Police Assistance Center (CPAC) officer patrolling Capitol Park during the Pili Festival in Burabod village, Sorsogon province, Philippines. The police officer was killed in the assault. No group claimed responsibility; however, sources attributed the attack to the New People's Army (NPA).",Police,New People's Army (NPA),Firearms,1,0
149655,201506300022,2015,6,30,Philippines,Southeast Asia,Camarines Norte,Magsaysay,14.285594,122.469369,"06/30/2015: Assailants opened fire on a Citizens Armed Forces Geographical Unit (CAFGU) soldier watching a public dance in Magsaysay village, Camarines Norte province, Philippines. The soldier was killed in the assault. No group claimed responsibility; however, sources attributed the attack to the New People's Army (NPA).",Military,New People's Army (NPA),Firearms,1,0
149670,201506300063,2015,6,30,Philippines,Southeast Asia,Compostela Valley,Araibo,7.250822,126.16816899999999,"06/30/2015: Security forces identified and arrested an assailant planting explosive devices in Araibo, Compostela Valley province, Philippines. Both devices were safely defused. No group claimed responsibility; however, sources attributed the attack to the New People's Army (NPA).",Unknown,New People's Army (NPA),Explosives/Bombs/Dynamite,0,0
149692,201506300126,2015,6,30,Philippines,Southeast Asia,Maguindanao,Salbo,6.926258,124.41501399999999,"06/30/2015: Assailants opened fire on two police officers in Sitio Man-ol, Salbo village, Maguindanao province, Philippines. One officer was killed and the other was injured in the attack. The Bangsamoro Islamic Freedom Movement (BIFM) claimed responsibility for the incident.",Police,Bangsamoro Islamic Freedom Movement (BIFM),Firearms,1,1
149769,201507020055,2015,7,2,Philippines,Southeast Asia,Agusan del Sur,Binucayan,8.058913,125.861375,"07/02/2015: Assailants detonated a landmine and opened fire against military personnel in Binucayan village, Loreto town, Agusan del Sur province, Philippines. Four soldiers were injured in the attack. No group claimed responsibility; however, sources attributed the incident to the New People's Army (NPA).",Military,New People's Army (NPA),Explosives/Bombs/Dynamite,0,4
149827,201507030106,2015,7,3,Philippines,Southeast Asia,Davao del Norte,Palma Gil,7.661141000000001,125.55897,"07/03/2015: Assailants opened fire on a civilian in Palma Gil village, Talaingod town, Davao del Norte province, Philippines. The civilian was wounded in the attack. No group claimed responsibility; however, sources attributed the incident to the New People's Army (NPA).",Private Citizens & Property,New People's Army (NPA),Firearms,0,1
149858,201507040056,2015,7,4,Philippines,Southeast Asia,Compostela Valley,Maragusan,7.352189,126.15454,"07/04/2015: Fifteen assailants detonated two explosive devices inside the hangar of a Dole-Stanfilco Philippines banana plantation in Maragusan town, Compostela Valley province, Philippines. There were no reported casualties, although the hangar, an aircraft, and a bridge were damaged in the blast. No group claimed responsibility for the incident; however, sources attributed the attack to the New People's Army (NPA).",Business,New People's Army (NPA),Explosives/Bombs/Dynamite,0,0
149860,201507040058,2015,7,4,Philippines,Southeast Asia,Sulu,Bus-Bus,6.060263,121.00883999999999,"07/04/2015: An assailant opened fire on Marine soldiers in Sitio Lungan Gitong, Bus-Bus village, Sulu province, Philippines. A soldier was killed and another was injured in the attack. No group claimed responsibility for the incident; however, police officials suspected that the assailant was a member of the Abu Sayyaf Group (ASG).",Military,Abu Sayyaf Group (ASG),Firearms,1,1
149868,201507040067,2015,7,4,Philippines,Southeast Asia,Masbate,Buenos Aires,12.49646,123.717095,"07/04/2015: Assailants opened fire on Bobby Azares in Buenos Aires village, Masbate province, Philippines. Azares, a fish vendor, was killed in the attack. No group claimed responsibility for the incident; however, sources attributed the attack to the New People's Army (NPA).",Private Citizens & Property,New People's Army (NPA),Firearms,1,0
149880,201507040090,2015,7,4,Philippines,Southeast Asia,Maguindanao,Shariff Aguak,6.861859,124.444639,"07/04/2015: Assailants armed with assault rifles and grenade projectiles attacked a Special Action Force (SAF) outpost in Shariff Aguak town, Maguindanao province, Philippines. Four assailants were injured in the ensuing clash; the police officials did not sustain any casualties. No group claimed responsibility for the incident; however, sources attributed the attack to the Bangsamoro Islamic Freedom Movement (BIFM).",Police,Bangsamoro Islamic Freedom Movement (BIFM),Explosives/Bombs/Dynamite,0,4
149910,201507050052,2015,7,5,Philippines,Southeast Asia,Compostela Valley,Aguinaldo,7.922110000000001,125.846823,"07/05/2015: Assailants opened fire on a joint Citizen Armed Forces Geographical Unit (CAFGU) and military patrol in Aguinaldo village, Laak district, Compostela Valley province, Philippines. One CAFGU member was killed and one soldier was injured in the ensuing clash; the assailants also sustained an undetermined number of casualties. No group claimed responsibility for the incident; however, sources attributed the attack to the New People's Army (NPA).",Military,New People's Army (NPA),Firearms,1,1
149911,201507050053,2015,7,5,Philippines,Southeast Asia,Sultan Kudarat,Sinapulan,6.634899000000001,125.08285500000001,"07/05/2015: Assailants set fire to a truck owned by Willie Estabillo, a businessperson, in Sinapulan village, Sultan Kudarat province, Philippines. There were no reported casualties, although the truck was damaged in the attack. The New People's Army (NPA) claimed responsibility for the incident",Business,New People's Army (NPA),Firearms,0,0
149925,201507050076,2015,7,5,Philippines,Southeast Asia,Maguindanao,Datu Hofer,6.942258,124.419824,"07/05/2015: Assailants shot and killed Corporal Saturnino Sargena at a market in Datu Hofer town, Maguindanao province, Philippines. The Bangsamoro Islamic Freedom Movement (BIFM) claimed responsibility for the incident.",Military,Bangsamoro Islamic Freedom Movement (BIFM),Firearms,1,0
149964,201507060085,2015,7,6,Philippines,Southeast Asia,Maguindanao,Labu-Labu,6.867985000000001,124.47638899999998,"07/06/2015: Assailants threw a grenade at the residence of Bai Monawara Ampatuan, the mayor of Datu Unsay, in Labu-Labu village, Maguindanao province, Philippines. Ampatuan was unharmed, although a carpenter, identified as Mandato Progonero, was injured in the blast. No group claimed responsibility for the incident.",Government (General),Unknown,Explosives/Bombs/Dynamite,0,1
149995,201507070049,2015,7,7,Philippines,Southeast Asia,Davao del Norte,Palma Gil,7.661141000000001,125.55897,"07/07/2015: Assailants detonated an explosive device and opened fire on a military patrol in Sitio Bayabas, Palma Gil village, Davao del Norte province, Philippines. Two soldiers were injured in the attack. No group claimed responsibility for the incident; however, sources attributed the attack to the New People's Army (NPA).",Military,New People's Army (NPA),Explosives/Bombs/Dynamite,0,2
149996,201507070050,2015,7,7,Philippines,Southeast Asia,Davao del Norte,Talaingod,7.6246,125.620494,"07/07/2015: Assailants planted an unknown number of landmines in Talaingod town, Davao del Norte province, Philippines. The outcome of the attack is unknown. No group claimed responsibility for the incident; however, sources attributed the attack to the New People's Army (NPA).",Unknown,New People's Army (NPA),Explosives/Bombs/Dynamite,0,0
149997,201507070051,2015,7,7,Philippines,Southeast Asia,Sulu,Jolo,6.047448,121.00131,"07/07/2015: An assailant threw a fragmentation grenade at a military truck on Scott Road in Jolo town, Sulu province, Philippines. At least 11 civilians were injured in the blast. No group claimed responsibility for the incident; however, military officials attributed the attack to the Abu Sayyaf Group (ASG).",Military,Abu Sayyaf Group (ASG),Explosives/Bombs/Dynamite,0,11
150012,201507070074,2015,7,7,Philippines,Southeast Asia,Compostela Valley,Andap,7.51951,126.216075,"07/07/2015: Authorities arrested two assailants carrying explosive devices in barangay Andap, Compostela Valley, Philippines. No group claimed responsibility; however, sources identified the assailants as members of the New People's Army (NPA).",Unknown,New People's Army (NPA),Explosives/Bombs/Dynamite,0,0
150013,201507070076,2015,7,7,Philippines,Southeast Asia,Maguindanao,Salbo,6.926258,124.41501399999999,"07/07/2015: Security forces discovered and defused an explosive device near a Citizens Armed Forces Geographical Unit (CAFGU) detachment in Salbo village, Maguindanao province, Philippines. No group claimed responsibility for the incident; however, military officials attributed the attempted attack to the Bangsamoro Islamic Freedom Movement (BIFM).",Unknown,Bangsamoro Islamic Freedom Movement (BIFM),Explosives/Bombs/Dynamite,0,0
150018,201507070087,2015,7,7,Philippines,Southeast Asia,Nueva Ecija,Penaranda district,15.353113,121.01668000000001,"07/07/2015: Assailants opened fire on Wilfredo Abesamis in his vehicle in Penaranda district, Nueva Ecija province, Philippines. Abesamis, a municipal councilor, was wounded in the attack. No group claimed responsibility for the incident.",Government (General),Unknown,Firearms,0,1
150067,201507090046,2015,7,9,Philippines,Southeast Asia,South Cotabato,Lamsuguing,6.37378,124.63818,"07/09/2015: Assailants detonated a roadside bomb and opened fire on a road construction team in Sitio Lamsuguing, Upper Sepaka village, South Cotabato province, Philippines. A project engineer, identified as Junesis Austria Miro, and two assailants were killed and three others were injured in the ensuing clash. No group claimed responsibility for the incident; however, sources attributed the attack to the New People's Army (NPA).",Military,New People's Army (NPA),Explosives/Bombs/Dynamite,3,3
150114,201507100061,2015,7,10,Philippines,Southeast Asia,Maguindanao,Sambulawan,7.000163000000001,124.485801,"07/10/2015: Assailants threw a grenade at the vehicle of village chairperson Sajid Ambiton in Sambulawan area, Maguindanao province, Philippines. Ambiton and a soldier were killed and a military captain was injured in the attack. No group claimed responsibility for the incident; however, sources attributed the attack to the Bangsamoro Islamic Freedom Movement (BIFM).",Government (General),Bangsamoro Islamic Freedom Movement (BIFM),Explosives/Bombs/Dynamite,2,1
150137,201507110008,2015,7,11,Philippines,Southeast Asia,Misamis Oriental,Alagatan,8.743889,125.06660500000001,"07/11/2015: Thirty assailants opened fire on military personnel in Alagatan village, Misamis Oriental province, Philippines. A soldier was killed and four others, including a soldier and two civilians, were injured in the ensuing clash. In addition, an injured soldier and a civilian were taken hostage as human shields. The civilian was released soon after; the whereabouts of the soldier are unknown. The New People's Army (NPA) claimed responsibility and stated that the attack was carried out because they believed that the military breached the law of war.",Military,New People's Army (NPA),Firearms,1,4
150155,201507110032,2015,7,11,Philippines,Southeast Asia,Catanduanes,San Andres district,13.595447,124.099567,"07/11/2015: Assailants attacked a bridge construction site in Cabungahan village, San Andres district, Cataduanes province, Philippines. The assailants gathered 15 workers into their barracks, threw an explosive device which failed to detonate, and set fire to a payloader during the attack. There were no reported casualties. The New People's Army (NPA) claimed responsibility for the incident and stated that the attack was carried out in relation to an extortion demand and because the construction firm disrespected the NPA.",Business,New People's Army (NPA),Explosives/Bombs/Dynamite,0,0
150206,201507120046,2015,7,12,Philippines,Southeast Asia,Quezon,Villa Ibaba,14.046327999999999,121.874954,"07/12/2015: Approximately 10 assailants attacked military personnel near the site of a planned coal-fired power plant in Sitio Carinay, Villa Ibaba village, Quezon province, Philippines. Three people, including an assailant, a soldier, and a civilian, were killed and four soldiers were injured in the ensuing clash. The New People's Army (NPA) claimed responsibility for the incident and stated that the attack was carried out in response to the locals' alleged opposition to a proposed power plant.",Military,New People's Army (NPA),Firearms,3,4
150236,201507130019,2015,7,13,Philippines,Southeast Asia,Lanao del Norte,Kalanganan,8.07595,124.251438,"07/13/2015: Assailants opened fire on a military patrol in Kalanganan village, Lanao del Norte province, Philippines. A soldier was killed and seven soldiers and two assailants were injured in the ensuing clash. No group claimed responsibility for the incident.",Military,Unknown,Firearms,1,9
150260,201507130069,2015,7,13,Philippines,Southeast Asia,Metropolitan Manila,Marikina,14.650511999999999,121.10269199999999,"07/13/2015: Three assailants attacked Chief Inspector Renato Sto. Domingo in Concepcion Uno neighborhood, Marikina City, Metropolitan Manila, Philippines. Domingo, the former Traffic Management and Enforcement division head, was killed in the attack. No group claimed responsibility for the incident; however, sources attributed the attack to the New People's Army (NPA).",Police,New People's Army (NPA),Firearms,1,0
150331,201507150038,2015,7,15,Philippines,Southeast Asia,Basilan,Tipo-Tipo,6.497901000000001,122.120277,"07/15/2015: A roadside bomb detonated targeting the convoy of Mujiv Hataman in Sitio Urot, Tipo-Tipo town, Basilan province, Philippines. Hataman, the Autonomous Region in Muslim Mindanao (ARMM) governor, was not harmed and there were no other reported casualties. In addition, two other roadside bombs were discovered and defused following the attack. No group claimed responsibility for the incident; however, sources attributed the attack to the Abu Sayyaf Group (ASG).",Government (General),Abu Sayyaf Group (ASG),Explosives/Bombs/Dynamite,0,0
150350,201507160006,2015,7,16,Philippines,Southeast Asia,Sorsogon,Irosin district,12.702727000000001,124.03411899999999,"07/16/2015: Assailants opened fire on military personnel in Bacolod village, Irosin district, Sorsogon province, Philippines. Three assailants were killed and two soldiers were injured in the ensuing clash. No group claimed responsibility for the incident; however, sources attributed the attack to the New People's Army (NPA).",Military,New People's Army (NPA),Firearms,3,2
150351,201507160007,2015,7,16,Philippines,Southeast Asia,Masbate,Bagacay,12.515989999999999,123.666215,"07/16/2015: Three assailants shot and killed a soldier in Bagacay village, Masbate province, Philippines. This was one of two related attacks in the area on this date. The New People's Army (NPA) claimed responsibility for the incidents.",Military,New People's Army (NPA),Firearms,1,0
150353,201507160011,2015,7,16,Philippines,Southeast Asia,Masbate,Bagacay,12.515989999999999,123.666215,"07/16/2015: A landmine detonated targeting military personnel responding to an earlier attack in Bagacay village, Masbate province, Philippines. There were no reported casualties in the blast. This was one of two related attacks in the area on this date. The New People's Army (NPA) claimed responsibility for the incidents.",Military,New People's Army (NPA),Explosives/Bombs/Dynamite,0,0
150354,201507160012,2015,7,16,Philippines,Southeast Asia,Misamis Oriental,Bulua,8.504375,124.61920500000001,"07/16/2015: Two assailants opened fire on Colonel Edwin Respicio in Bulua village, Misamis Oriental province, Philippines. Respicio, a senior military officer, was injured in the attack. No group claimed responsibility for the incident.",Military,Unknown,Firearms,0,1
150355,201507160013,2015,7,16,Philippines,Southeast Asia,Compostela Valley,San Antonio,7.282128999999999,125.857401,"07/16/2015: Assailants shot and killed an Sergeant Zerix Gallarde, an army ranger, in San Antonio village, Compostela Valley province, Philippines. No group claimed responsibility for the incident; however, sources attributed the attack to the New People's Army (NPA).",Military,New People's Army (NPA),Firearms,1,0
150392,201507170012,2015,7,17,Philippines,Southeast Asia,Compostela Valley,Tagugpo,7.216207000000001,126.013254,"07/17/2015: Assailants opened fire on a security patrol in Sitio Onor, Tagugpo village, Compostela Valley province, Philippines. Five security forces members were injured in the attack. No group claimed responsibility for the incident; however, sources attributed the attack to the New People's Army (NPA).",Military,New People's Army (NPA),Firearms,0,5
150404,201507170047,2015,7,17,Philippines,Southeast Asia,Davao del Sur,Digos,6.744295,125.355626,"07/17/2015: Assailants opened fire on Ustadz Rhagelin Barutoc in Rizal Park, Digos City, Davao del Sur province, Philippines. Barutoc, a Muslim leader, was killed in the attack. No group claimed responsibility for the incident.",Religious Figures/Institutions,Unknown,Firearms,1,0
150426,201507180005,2015,7,18,Philippines,Southeast Asia,Compostela Valley,Mabini,7.282128999999999,125.857401,"07/18/2015: An explosive device detonated near a police station in Mabini town, Compostela Valley province, Philippines. A civilian was injured in the blast. No group claimed responsibility for the incident; however, sources attributed the attack to the New People's Army (NPA).",Private Citizens & Property,New People's Army (NPA),Explosives/Bombs/Dynamite,0,1
