,id,year,month,day,country,region,state,city,latitude,longitude,summary,target,tgroup,weapon,fatalities,injuries
142020,201501010012,2015,1,1,Afghanistan,South Asia,Kapisa,Kortas,35.029167,69.363056,"01/01/2015: An explosive device detonated targeting Wakil Habib Afghan in Kortas area, Kapisa province, Afghanistan. Afghan, a member of parliament (MP), was not harmed in the attack, but one of his guards was killed and three other guards were wounded. The Taliban claimed responsibility for the incident.",Government (General),Taliban,Explosives/Bombs/Dynamite,1,3
142026,201501010022,2015,1,1,Afghanistan,South Asia,Nangarhar,Jalalabad,34.434093,70.44742,"01/01/2015: A magnetic explosive device attached to a police vehicle detonated in Jalalabad city, Nangarhar province, Afghanistan. A border police officer was killed and another was injured in the blast. No group claimed responsibility for the incident.",Police,Unknown,Explosives/Bombs/Dynamite,1,1
142043,201501010068,2015,1,1,Afghanistan,South Asia,Farah,Barangak,32.453788,62.031136,"01/01/2015: An explosive device detonated in Barangak village, Pusht Rod district, Farah province, Afghanistan. The son of an Afghan Local Police (ALP) commander was wounded in the blast. No group claimed responsibility for the incident.",Police,Unknown,Explosives/Bombs/Dynamite,0,1
142052,201501010081,2015,1,1,Afghanistan,South Asia,Nimroz,Delaram district,31.997362,63.298669999999994,"01/01/2015: Assailants attacked a police patrol in Delaram district, Nimroz province, Afghanistan. Five people, two police officers and three assailants, were killed and a police officer was injured in the ensuing clash. The Taliban claimed responsibility for the incident.",Police,Taliban,Firearms,5,1
142053,201501010082,2015,1,1,Afghanistan,South Asia,Kunduz,Unknown,36.728590999999994,68.868066,"01/01/2015: Two assailants attacked civilians while traveling on Sher Khan port-Kunduz highway in Kunduz province, Afghanistan. The two assailants were killed after exchanging fire with police officials. No group claimed responsibility for the incident.",Private Citizens & Property,Unknown,Firearms,2,0
142054,201501010083,2015,1,1,Afghanistan,South Asia,Kunduz,Imam Sahib district,37.184444,68.91444399999999,"01/01/2015: An assailant attempted to attach an explosive device to a police vehicle in Imam Sahib district, Kunduz province, Afghanistan. The assailant was apprehended by police officials. No group claimed responsibility for the incident.",Police,Unknown,Explosives/Bombs/Dynamite,0,0
142060,201501020043,2015,1,2,Afghanistan,South Asia,Uruzgan,Kharkrez,32.613889,65.81,"01/02/2015: An explosive device detonated targeting the home of a local tribal elder in Khar Kharkrez town, Uruzgan province, Afghanistan. At least one person, the elder's son, was killed in the blast. No group claimed responsibility for the incident.",Private Citizens & Property,Unknown,Explosives/Bombs/Dynamite,1,0
142073,201501020059,2015,1,2,Afghanistan,South Asia,Helmand,Lashkar Gah,31.582865,64.368809,"01/02/2015: A magnetic explosive device attached to a vehicle carrying Azizi Bank employees detonated in Lashkar Gah city, Helmand province, Afghanistan. Three bank employees, including the bank's branch manager, and a police officer were killed and an unknown number of others were injured in the blast. No group claimed responsibility for the incident.",Business,Unknown,Explosives/Bombs/Dynamite,4,0
142078,201501020068,2015,1,2,Afghanistan,South Asia,Kunduz,Imam Sahib district,37.110345,68.849843,"01/02/2015: Assailants attacked an Afghan Local Police (ALP) checkpoint in Aski area, Imam Sahib district, Kunduz province, Afghanistan. At least six people, including two police officers and three assailants, were killed and one officer was wounded in the ensuing clash. The Taliban claimed responsibility for the incident.",Police,Taliban,Firearms,6,1
142083,201501020078,2015,1,2,Afghanistan,South Asia,Parwan,Bagram,34.942699,69.262517,"01/02/2015: Assailants fired a missile at Bagram Air Base in Bagram district, Parwan province, Afghanistan. No one was injured in the attack. The Taliban claimed responsibility for the incident.",Military,Taliban,Explosives/Bombs/Dynamite,0,0
142086,201501020081,2015,1,2,Afghanistan,South Asia,Nangarhar,Jalalabad,34.434093,70.44742,"01/02/2015: Two rockets were fired at the airport in Jalalabad city, Nangarhar province, Afghanistan. The attack resulted in an unstated number of casualties. No group claimed responsibility for the incident.",Military,Unknown,Explosives/Bombs/Dynamite,0,0
142087,201501020082,2015,1,2,Afghanistan,South Asia,Khost,Tani district,33.242222,69.828056,"01/02/2015: An explosive device prematurely detonated as it was being planted in Senkio area, Tani district, Khost province, Afghanistan. An assailant was killed in the blast. No group claimed responsibility for the incident.",Unknown,Unknown,Explosives/Bombs/Dynamite,1,0
142103,201501030050,2015,1,3,Afghanistan,South Asia,Herat,Herat,34.341926,62.203101000000004,"01/03/2015: Assailants threw a grenade at a checkpoint guarding the Pakistani consulate in Herat city, Herat province, Afghanistan. No one was injured, but the checkpoint was damaged in the attack. No group claimed responsibility for the incident.",Government (Diplomatic),Unknown,Explosives/Bombs/Dynamite,0,0
142104,201501030052,2015,1,3,Afghanistan,South Asia,Wardak,Saydabad district,33.914076,68.656837,"01/03/2015: Assailants abducted police officers from a neighboring province in Saydabad district, Wardak province, Afghanistan. The dead bodies of the four abducted officers were discovered the following day. No group claimed responsibility; however, sources attributed the incident to the Taliban.",Police,Taliban,Firearms,4,0
142108,201501030059,2015,1,3,Afghanistan,South Asia,Herat,Herat,34.341926,62.203101000000004,"01/03/2015: An explosive device attached to an Afghan National Army (ANA) vehicle detonated in Herat city, Herat province, Afghanistan. Two soldiers were injured in the blast. No group claimed responsibility for the incident.",Military,Unknown,Explosives/Bombs/Dynamite,0,2
142120,201501030082,2015,1,3,Afghanistan,South Asia,Ghazni,Ghazni,33.549963,68.416399,"01/03/2015: Assailants attacked a doctor and her husband in Mangor area, Ghazni city, Ghazni province, Afghanistan. Both targets were killed in the attack. No group claimed responsibility for the incident.",Private Citizens & Property,Unknown,Firearms,2,0
142121,201501030083,2015,1,3,Afghanistan,South Asia,Nuristan,Waygal district,35.221191999999995,71.049777,"01/03/2015: Assailants killed a National Directorate of Security (NDS) employee in Masigram village, Waygal district, Nuristan province, Afghanistan. This was one of two related attacks in Waygal on the same date. No group claimed responsibility for the incident.",Government (General),Unknown,Firearms,1,0
142122,201501030084,2015,1,3,Afghanistan,South Asia,Nuristan,Waygal district,35.190189000000004,70.993524,"01/03/2015: Assailants set fire to the house of a friend of a National Directorate of Security (NDS) employee killed in an earlier attack in Waygal district, Nuristan province, Afghanistan. There were no reports of casualties in the attack. This was one of two related attacks in Waygal on the same date. No group claimed responsibility for the incident.",Government (General),Unknown,Incendiary,0,0
142152,201501040018,2015,1,4,Afghanistan,South Asia,Logar,Deh-e Shaykh,33.962224,68.924973,"01/04/2015: Assailants attacked a patrol including the commander of the National Uprising Movement (NUM) militia in Deh-e Shaykh town, Barak-i-Barak district, Logar province, Afghanistan. Four uprising members were killed and one was injured in the attack. The Taliban claimed responsibility for the incident.",Terrorists/Non-State Militia,Taliban,Firearms,5,0
142153,201501040019,2015,1,4,Afghanistan,South Asia,Herat,Herat,34.341926,62.203101000000004,"01/04/2015: Assailants opened fire on a retired judge in Herat city, Herat province, Afghanistan. The judge, Mohammad Ismail, was killed in the attack. The Taliban claimed responsibility for the incident.",Government (General),Taliban,Firearms,1,0
142165,201501040035,2015,1,4,Afghanistan,South Asia,Ghazni,Barah Kala,33.065829,68.233333,"01/04/2015: An explosive device hidden in a police vehicle exploded in Barah Kala area, Qarabagh district, Ghazni province, Afghanistan. Two police officers, including the deputy head of a criminal investigation unit, were killed and at least two officers were wounded in the blast. No group claimed responsibility for the incident.",Police,Unknown,Explosives/Bombs/Dynamite,2,2
142166,201501040036,2015,1,4,Afghanistan,South Asia,Farah,Barangak,32.453788,62.031136,"01/04/2015: An explosive device detonated in Barangak village, Pusht Rood district, Farah province, Afghanistan. One Afghan Local Police (ALP) officer was killed and a civilian was wounded in the blast. No group claimed responsibility for the incident.",Police,Unknown,Explosives/Bombs/Dynamite,1,1
142167,201501040037,2015,1,4,Afghanistan,South Asia,Kandahar,Kandahar,31.612834999999997,65.70215999999999,"01/04/2015: Assailants opened fire on two police officers in Kandahar city, Kandahar province, Afghanistan. The two police officers were killed in the attack. This was one of three related attacks in Kandahar city on the same date. The Taliban claimed responsibility for the incident.",Police,Taliban,Firearms,2,0
142168,201501040038,2015,1,4,Afghanistan,South Asia,Kandahar,Kandahar,31.612834999999997,65.70215999999999,"01/04/2015: Assailants opened fire on a police officer in Kandahar city, Kandahar province, Afghanistan. The police officer was wounded in the attack. This was one of three related attacks in Kandahar city on the same date. The Taliban claimed responsibility for the incident.",Police,Taliban,Firearms,0,1
142169,201501040039,2015,1,4,Afghanistan,South Asia,Kandahar,Kandahar,31.613509000000004,65.7164,"01/04/2015: An explosive device hidden in a flowerpot detonated in Hazrat Ji Baba area, Kandahar city, Kandahar province, Afghanistan. A civilian was wounded in the blast. This was one of three related attacks in Kandahar city on the same date. The Taliban claimed responsibility for the incident.",Private Citizens & Property,Taliban,Explosives/Bombs/Dynamite,0,1
142200,201501050025,2015,1,5,Afghanistan,South Asia,Kabul,Kabul,34.533498,69.166579,"01/05/2015: An explosives-laden vehicle detonated targeting a European Union police (EUPOL) vehicle on the outskirts of Kabul city, Kabul province, Afghanistan. Two people were killed, including an assailant, and five civilians were wounded in the blast. The Taliban claimed responsibility for the incident.",Government (Diplomatic),Taliban,Explosives/Bombs/Dynamite,2,5
142201,201501050027,2015,1,5,Afghanistan,South Asia,Zabul,Qalat,32.106139,66.906922,"01/05/2015: A suicide bomber in an explosives-laden vehicle detonated near the convoy of General Ghulam Jilani Khan in Qalat city, Zabul province, Afghanistan. Khan, an Afghan Police Deputy Chief, was not harmed; however, at least three people, including the bomber and two civilians, were killed and nine others were wounded in the blast. The Taliban claimed responsibility for the incident.",Police,Taliban,Explosives/Bombs/Dynamite,3,9
142206,201501050037,2015,1,5,Afghanistan,South Asia,Nangarhar,Unknown,34.171831,70.621679,"01/05/2015: A suicide bomber in an explosives-laden vehicle detonated targeting a North Atlantic Treaty Organization (NATO) convoy on Jalalabad-Torkham highway in Nangarhar province, Afghanistan. The bomber was killed and there were no other reported casualties. The Taliban claimed responsibility for the incident.",Military,Taliban,Explosives/Bombs/Dynamite,1,0
142207,201501050038,2015,1,5,Afghanistan,South Asia,Kunar,Dangam district,35.008338,71.450864,"01/05/2015: An explosive device detonated after a civilian stepped on it in Dangam district, Kunar province, Afghanistan. The device was intended for Afghan security forces; however, the civilian was killed in the blast. No group claimed responsibility for the incident.",Military,Unknown,Explosives/Bombs/Dynamite,1,0
142210,201501050043,2015,1,5,Afghanistan,South Asia,Sari Pul,Dahane Tarpac,35.207547,66.27115400000001,"01/05/2015: Three suicide bombers attempted to attack the provincial headquarters in Dahane Tarpac area, between Balkhab and Kohistanat districts, Sari Pul province, Afghanistan. Two of the assailants were killed after being identified by local residents, while the third assailant was injured and arrested. No group claimed responsibility for the incident.",Government (General),Unknown,Explosives/Bombs/Dynamite,2,1
142217,201501050054,2015,1,5,Afghanistan,South Asia,Khost,Shambawat,33.371389,69.74333299999999,"01/05/2015: An explosive device detonated targeting an Afghan National Army (ANA) vehicle in Shambawat area, Nadar Shah Kot district, Khost province, Afghanistan. Two soldiers were wounded in the blast. The Taliban claimed responsibility for the incident.",Military,Taliban,Explosives/Bombs/Dynamite,0,2
142218,201501050055,2015,1,5,Afghanistan,South Asia,Farah,Bala Buluk district,32.794568,62.75780699999999,"01/05/2015: Assailants attacked a police post in Bala Buluk district, Farah province, Afghanistan. One police officer and two assailants were killed in the ensuing clash. No group claimed responsibility; however, sources attributed the incident to the Taliban.",Police,Taliban,Unknown,3,0
142221,201501050058,2015,1,5,Afghanistan,South Asia,Nangarhar,Pachir Agam district,34.2,70.278056,"01/05/2015: Assailants attacked security forces in Pachir Agam district, Nangarhar province, Afghanistan. Five assailants were killed and six assailants were wounded when forces returned fire. The Taliban claimed responsibility for the incident.",Military,Taliban,Firearms,5,6
142231,201501060007,2015,1,6,Afghanistan,South Asia,Helmand,Shaykh Zai,32.437599,64.47940799999999,"01/06/2015: Assailants fired a rocket at a civilian house in Shaykh Zai village, Nawzad district, Helmand province, Afghanistan. Three civilians were killed and two were wounded in the attack. No group claimed responsibility; however, sources attributed the incident to the Taliban.",Private Citizens & Property,Taliban,Explosives/Bombs/Dynamite,3,2
142234,201501060010,2015,1,6,Afghanistan,South Asia,Wardak,Saydabad district,34.007712,68.714007,"01/06/2015: Assailants set fire to the house of Doctor Muslim in Saydabad district, Wardak province, Afghanistan. Muslim, a district chief, was not harmed in the attack, but the house was damaged. No group claimed responsibility for the incident.",Government (General),Unknown,Incendiary,0,0
142252,201501060037,2015,1,6,Afghanistan,South Asia,Ghazni,Giro district,33.033668,68.33116700000001,"01/06/2015: An explosive device planted in a rickshaw detonated in Giru district, Ghazni province, Afghanistan. Three children were killed and two children were wounded in the blast. No group claimed responsibility; however, sources attributed the incident the Taliban.",Transportation,Taliban,Explosives/Bombs/Dynamite,3,2
142253,201501060038,2015,1,6,Afghanistan,South Asia,Wardak,Dasht Top,34.165001000000004,68.790285,"01/06/2015: Assailants set fire to a telecommunications tower in Dasht Top area, Syedabad district, Wardak province, Afghanistan. No one was injured and the tower was undamaged in the attack. No group claimed responsibility for the incident.",Telecommunication,Unknown,Incendiary,0,0
142254,201501060039,2015,1,6,Afghanistan,South Asia,Wardak,Dasht Top,34.165001000000004,68.790285,"01/06/2015: Assailants stormed a seminary in Dasht Top area, Syedabad district, Wardak province, Afghanistan. There was an unstated number of casualties, and the seminary was damaged in the attack. No group claimed responsibility for the incident.",Educational Institution,Unknown,Unknown,0,0
142259,201501070003,2015,1,7,Afghanistan,South Asia,Khost,Khost,33.333109,69.916917,"01/07/2015: Three suicide bombers attacked the police academy in Khost city, Khost province, Afghanistan. One suicide bomber detonated at the gates and the other two rushed inside, only to later detonate their explosive devices. All three assailants were killed and three people, at least one police officer and at least one civilian, were wounded in the attack. The Taliban claimed responsibility for the incident.",Police,Taliban,Explosives/Bombs/Dynamite,3,3
142263,201501070007,2015,1,7,Afghanistan,South Asia,Nangarhar,Jalalabad,34.434093,70.44742,"01/07/2015: An explosive device attached to the vehicle of Mahmood-ul-Hasan detonated near a mosque in Jalalabad city, Nangarhar province, Afghanistan. Hasan, who was a judge, was killed in the blast, and at least two of his children were wounded. The Taliban claimed responsibility for the incident.",Government (General),Taliban,Explosives/Bombs/Dynamite,1,2
142264,201501070008,2015,1,7,Afghanistan,South Asia,Baghlan,Chahar Shanbeh Tepa,36.296755,68.81430300000001,"01/07/2015: Assailants attacked two road construction vehicles in Chahar Shanbeh Tepa, Baghlan province, Afghanistan. Six workers were killed and one was wounded in the attack. Three workers were also kidnapped; their whereabouts were unknown. The Taliban claimed responsibility for the incident.",Business,Taliban,Firearms,6,1
142276,201501070026,2015,1,7,Afghanistan,South Asia,Ghazni,Andar district,33.305833,68.44694399999999,"01/07/2015: A police vehicle struck an explosive device in Mulla Nuh locality, Andar district, Ghazni province, Afghanistan. One police officer was killed and two police officers were wounded in the blast. No group claimed responsibility for the incident.",Police,Unknown,Explosives/Bombs/Dynamite,1,2
142277,201501070027,2015,1,7,Afghanistan,South Asia,Ghazni,Gelan district,32.727268,67.635903,"01/07/2015: An explosive device detonated in Gelan district, Ghazni province, Afghanistan. A public uprising commander and two of his bodyguards were wounded in the blast. No group claimed responsibility for the incident.",Terrorists/Non-State Militia,Unknown,Explosives/Bombs/Dynamite,0,3
142278,201501070028,2015,1,7,Afghanistan,South Asia,Uruzgan,Tarin Kot,32.626453999999995,65.87301500000001,"01/07/2015: Assailants opened fire on two Afghan National Police (ANP) officers in Kotwal area, Tarin Kot city, Uruzgan province, Afghanistan. The officers were killed in the attack. No group claimed responsibility; however, sources attributed the incident to the Taliban.",Police,Taliban,Firearms,2,0
142281,201501070034,2015,1,7,Afghanistan,South Asia,Uruzgan,Khas Uruzgan district,32.938449,66.638056,"01/07/2015: An explosive device detonated in Khas Uruzgan district, Uruzgan province, Afghanistan. Three soldiers were wounded in the blast. No group claimed responsibility for the incident.",Military,Unknown,Explosives/Bombs/Dynamite,0,3
142282,201501070035,2015,1,7,Afghanistan,South Asia,Helmand,Naw Zad district,32.397381,64.47316,"01/07/2015: A suicide bomber in an explosives-laden vehicle attempted to attack a police compound in Naw Zad district, Helmand province, Afghanistan. A police officer preempted the attack and shot the bomber, causing a premature explosion. The bomber and the police officer were killed in the attack. The Taliban claimed responsibility for the incident.",Police,Taliban,Explosives/Bombs/Dynamite,2,0
142303,201501070072,2015,1,7,Afghanistan,South Asia,Kabul,Kabul,34.533278,69.166622,"01/07/2015: Security forces identified and arrested a suicide bomber in Kabul city, Kabul province, Afghanistan. No group claimed responsibility for the incident; however, sources attributed the attempted attack to the Haqqani Network.",Unknown,Haqqani Network,Explosives/Bombs/Dynamite,0,0
142325,201501080015,2015,1,8,Afghanistan,South Asia,Uruzgan,Shaplogh,32.684456,66.192955,"01/08/2015: An explosive device detonated targeting a police vehicle in Shaplogh area, Uruzgan province, Afghanistan. One police officer was killed and two were wounded in the blast. No group claimed responsibility; however, sources attributed the incident to the Taliban.",Police,Taliban,Explosives/Bombs/Dynamite,1,2
142341,201501080037,2015,1,8,Afghanistan,South Asia,Kunduz,Kunduz,36.728555,68.868156,"01/08/2015: An explosive device detonated as assailants attempted to plant it near a high school outside of Kunduz city, Kunduz province, Afghanistan. Two assailants were wounded in the blast. No group claimed responsibility; however, sources attributed the attack to the Taliban.",Military,Taliban,Explosives/Bombs/Dynamite,0,2
142351,201501080056,2015,1,8,Afghanistan,South Asia,Herat,Shindand district,33.305667,62.156307,"01/08/2015: Assailants attacked the vehicle of Muhammad Nasim in Shindand district, Herat province, Afghanistan. Nahim, the mayor of Shindand, was not harmed in the attack, but the vehicle was damaged. No group claimed responsibility for the incident.",Government (General),Unknown,Firearms,0,0
142387,201501090014,2015,1,9,Afghanistan,South Asia,Logar,Dado Khel,34.090738,69.093223,"01/09/2015: Assailants attacked a group of de-miners in Dado Khel village, Logar province, Afghanistan. Three vehicles were set ablaze and eight de-miners were abducted in the attack. The kidnapped de-miners were freed the following day. No group claimed responsibility; however, sources attributed the incident to the Taliban.",NGO,Taliban,Firearms,0,0
142401,201501090044,2015,1,9,Afghanistan,South Asia,Helmand,Kundir,32.260556,64.815,"01/09/2015: Assailants attacked a police post in Kundir village, Musa Kala district, Helmand province, Afghanistan. At least five police officers were killed and one officer was wounded in the attack. The Taliban claimed responsibility for the incident.",Police,Taliban,Firearms,5,1
142431,201501100030,2015,1,10,Afghanistan,South Asia,Kunar,Wata Pur district,34.927108000000004,71.089311,"01/10/2015: Assailants abducted Sahib Rasul and his companion in Wata Pur district, Kunar province, Afghanistan. The whereabouts of Rasul, the Provincial Deputy Director of the Afghan Ministry of Communications and Information Technology, and his friend are unknown. No group claimed responsibility for the incident; however, sources attributed the abduction to the Taliban.",Government (General),Taliban,Firearms,0,0
142432,201501100031,2015,1,10,Afghanistan,South Asia,Kunar,Chonrri,34.992297,71.419353,"01/10/2015: Assailants set an Afghan Wireless Communication Company (AWCC) cell phone tower on fire in Chonrri area, Kunar province, Afghanistan. A technician was killed and the tower was damaged in the attack. The Taliban claimed responsibility for the incident and stated that they had previously warned the Afghan Wireless Communication Company (AWCC) to stop operations because the Afghan security forces used their equipment to find Taliban camps.",Telecommunication,Taliban,Incendiary,1,0
142433,201501100032,2015,1,10,Afghanistan,South Asia,Sari Pul,Sangcharak district,35.967023,66.44203,"01/10/2015: Assailants opened fire on the vehicle of Hakim Beg in Sangcharak district, Sari Pul province, Afghanistan. Beg, a district police chief, was killed and two people were wounded in the attack. The Taliban claimed responsibility for the incident.",Police,Taliban,Firearms,1,2
142452,201501100077,2015,1,10,Afghanistan,South Asia,Nangarhar,Jalalabad,34.433797999999996,70.447241,"01/10/2015: Assailants opened fire on an anti-corruption court judge in Khalis Family area, Jalalabad city, Nangarhar province, Afghanistan. The judge was killed in the attack. No group claimed responsibility for the incident.",Government (General),Unknown,Firearms,1,0
142453,201501100078,2015,1,9,Afghanistan,South Asia,Paktika,Sharana,33.177132,68.781077,"01/09/2015: A suicide bomber attacked the vehicle of Abdul Karim Mateen in Sharana city, Paktika province, Afghanistan. Mateen, the governor of Paktika, was not harmed in the attack, but the bomber was killed and one of the governor's bodyguards were wounded in the blast. The Taliban claimed responsibility for the incident.",Government (General),Taliban,Explosives/Bombs/Dynamite,1,1
142454,201501100080,2015,1,9,Afghanistan,South Asia,Sari Pul,Boghavi,36.169872999999995,66.093838,"01/09/2015: Assailants kidnapped 12 civilians in Bughawi village, Sari Pul province, Afghanistan. Two of the victims were killed soon afterward; the remaining ten were released three days afterward. No group claimed responsibility; however, sources attributed the incident to the Taliban.",Private Citizens & Property,Taliban,Firearms,2,0
142455,201501100081,2015,1,10,Afghanistan,South Asia,Paktia,Gardez,33.600112,69.21676500000001,"01/10/2015: Security forces arrested a suicide bomber and seized his explosives-laden vehicle in Gardez city, Paktia province, Afghanistan. No group claimed responsibility for the incident.",Unknown,Unknown,Explosives/Bombs/Dynamite,0,0
142475,201501100112,2015,1,10,Afghanistan,South Asia,Wardak,Saydabad district,34.007712,68.714007,"01/10/2015: Assailants set fire to the residence of Farooq Wardak in Onkhi area, Saydabad district, Wardak province, Afghanistan. Wardak, the former education minister, was unharmed; however, the house was damaged in the attack. No group claimed responsibility for the incident.",Government (General),Unknown,Incendiary,0,0
142477,201501100115,2015,1,10,Afghanistan,South Asia,Ghor,Feroz Koh,34.526334000000006,65.256242,"01/10/2015: Assailants ambushed police and military personnel near Feroz Koh, Ghor province, Afghanistan. Two assailants were killed and ten people, including five soldiers, two civilians, and three assailants, were injured in the ensuing clash. The Taliban claimed responsibility for the incident.",Military,Taliban,Explosives/Bombs/Dynamite,2,10
