,id,year,month,day,country,region,state,city,latitude,longitude,summary,target,tgroup,weapon,fatalities,injuries
152632,201509110010,2015,9,11,Afghanistan,South Asia,Parwan,Bagram,34.941138,69.26250300000001,"09/11/2015: Assailants fired rockets at the Bagram Airbase in Bagram district, Parwan province, Afghanistan. This was one of three coordinated overnight attacks on the base. There were no reported casualties resulting from the assaults. The Taliban claimed responsibility for the incidents.",Military,Taliban,Explosives/Bombs/Dynamite,0,0
152633,201509110011,2015,9,11,Afghanistan,South Asia,Parwan,Bagram,34.941217,69.262761,"09/11/2015: Assailants fired rockets at the Bagram Airbase in Bagram district, Parwan province, Afghanistan. This was one of three coordinated overnight attacks on the base. There were no reported casualties resulting from the assaults. The Taliban claimed responsibility for the incidents.",Military,Taliban,Explosives/Bombs/Dynamite,0,0
152667,201509120001,2015,9,12,Afghanistan,South Asia,Jawzjan,Kikar Takjar,36.464822,65.811708,"09/12/2015: Assailants kidnapped four government officials in Kikar Takjar area, Jawzjan province, Afghanistan. All four hostages were released on September 14, 2015. No group claimed responsibility for the incident; however, sources attributed the attack to the Taliban.",Government (General),Taliban,Firearms,0,0
152668,201509120002,2015,9,12,Afghanistan,South Asia,Kabul,Qarabagh district,34.845884999999996,69.219084,"09/12/2015: Two suicide bombers detonated an explosives-laden vehicle targeting a legislator's son in Qarabagh district, Kabul, Afghanistan. The son was not harmed; however, at least one person was injured in the blast. No group claimed responsibility for the incident.",Government (General),Unknown,Explosives/Bombs/Dynamite,2,1
152669,201509120003,2015,9,12,Afghanistan,South Asia,Kandahar,Unknown,31.628871000000004,65.737175,"09/12/2015: Security forces discovered and defused 117 explosive devices in Kandahar, Afghanistan. No group claimed responsibility for the unsuccessful incident.",Unknown,Unknown,Explosives/Bombs/Dynamite,0,0
152670,201509120004,2015,9,12,Afghanistan,South Asia,Khost,Chinargai,33.510296999999994,70.051889,"09/12/2015: Assailants attacked a police checkpoint in Chinargai area, Bak district, Khost province, Afghanistan. At least one police officer and 12 assailants were killed and at least 12 assailants and three police officers were injured in the ensuing clash. The Taliban claimed responsibility for the incident.",Police,Taliban,Firearms,13,15
152671,201509120006,2015,9,12,Afghanistan,South Asia,Badakhshan,Yawan district,37.528069,70.380204,"09/12/2015: Assailants ambushed a convoy of United Nations World Food Program (WFP) vehicles in Yawan district, Badakhshan province, Afghanistan. At least five drivers were held hostage and released the following day after they were beaten. Additionally, five vehicles were set on fire during the attack. No group claimed responsibility for the incident; however, sources attributed the attack to the Taliban.",Government (Diplomatic),Taliban,Firearms,0,5
152697,201509130005,2015,9,13,Afghanistan,South Asia,Nimroz,Chahar Burja district,30.305433,61.895848,"09/13/2015: Assailants attacked military positions in Chahar Burjak district, Nimroz province, Afghanistan. Security forces repelled the assault, killing seven assailants and injuring two. No group claimed responsibility for the incident; however, sources attributed the attack to the Taliban.",Military,Taliban,Firearms,5,2
152731,201509140005,2015,9,14,Afghanistan,South Asia,Ghazni,Ghazni,33.545059,68.417397,"09/14/2015: Assailants attacked a prison with an explosives-laden vehicle, rocket-propelled grenades, and firearms in Ghazni city, Ghazni province, Afghanistan. At least four police officers and three assailants were killed and seven officers and four inmates were injured in the raid. In addition, at least 350 prisoners were released or escaped. The Taliban claimed responsibility for the incident.",Police,Taliban,Explosives/Bombs/Dynamite,7,11
152732,201509140006,2015,9,14,Afghanistan,South Asia,Nangarhar,Muhmand Dara district,34.242545,70.917709,"09/14/2015: Security forces identified and killed two suicide bombers in an explosives-laden vehicle in Muhmand Dara district, Nangarhar province, Afghanistan. No group claimed responsibility for the incident; however, sources attributed the attack to the Taliban.",Unknown,Taliban,Explosives/Bombs/Dynamite,2,0
152788,201509150001,2015,9,15,Afghanistan,South Asia,Kapisa,Alasay district,34.920065,69.818279,"09/15/2015: An explosive device detonated at a market in Alasay district, Kapisa province, Afghanistan. At least two people were killed and seven people were injured in the blast. No group claimed responsibility for the incident; however, sources attributed the attack to the Taliban.",Private Citizens & Property,Taliban,Explosives/Bombs/Dynamite,2,7
152789,201509150002,2015,9,15,Afghanistan,South Asia,Ghazni,Chahar Dewali,33.373471,68.457719,"09/15/2015: Assailants opened fire on a vehicle carrying civilians and Afghan National Army (ANA) soldiers in Chahar Dewali area, Andar district, Ghazni province, Afghanistan. Five civilians and a soldier were killed and a second soldier was injured in the attack. The Taliban claimed responsibility for the incident.",Military,Taliban,Firearms,6,1
152804,201509150042,2015,9,15,Afghanistan,South Asia,Kandahar,Takhteh Pol,31.319446000000003,65.96024200000001,"09/15/2015: A roadside bomb detonated targeting a vaccination team near Takhteh Pol, Kandahar province, Afghanistan. Seven health workers were injured in the blast. No group claimed responsibility for the incident.",Private Citizens & Property,Unknown,Explosives/Bombs/Dynamite,0,7
152812,201509150058,2015,9,15,Afghanistan,South Asia,Paktika,Jani Khail district,32.729749,68.390119,"09/15/2015: Assailants attacked a police checkpost in Shahtoro area, Jani Khail district, Paktika province, Afghanistan. Three police officers and five assailants were killed and five officers were injured in the ensuing clash. No group claimed responsibility for the incident; however, sources attributed the attack to the Taliban.",Police,Taliban,Unknown,8,5
152815,201509150062,2015,9,15,Afghanistan,South Asia,Nangarhar,Ghani Khel,34.196199,70.78339,"09/15/2015: Assailants abducted three civilians in 25th canal area, Ghani Khel district, Nangarhar province, Afghanistan. Two of the victims were found dead the following day. The whereabouts of the third hostage are unknown. No group claimed responsibility for the abduction.",Private Citizens & Property,Unknown,Firearms,2,0
152816,201509150072,2015,9,15,Afghanistan,South Asia,Sari Pul,Khandan,35.778866,65.833987,"09/15/2015: Assailants attacked an Afghan Police checkpoint in Khandan, Sari Pul province , Afghanistan. At least three officers were killed and two others were injured in the incident. No group claimed responsibility; however, sources attributed the attack to the Taliban.",Police,Taliban,Unknown,3,2
152817,201509150073,2015,9,15,Afghanistan,South Asia,Uruzgan,Tarin Kot,32.636459,65.893592,"09/15/2015: An assailant opened fire on Hajji Ghani, a tribal elder, in Khero Karez area, Uruzgan province, Afghanistan. The assailant was killed and Ghani was wounded in the attack. No group claimed responsibility for the incident; however, sources attributed the attack to the Taliban.",Private Citizens & Property,Taliban,Firearms,1,1
152818,201509150074,2015,9,16,Afghanistan,South Asia,Jawzjan,Qara Darya,36.664190000000005,65.751154,"09/16/2015: Assailants attacked military checkpoints in Qara Darya village, Sheberghan city, Jawzjan province, Afghanistan. At least two assailants were killed and three assailants were injured in the ensuing clash. No group claimed responsibility for the incident; however, sources attributed the attack to the Taliban.",Military,Taliban,Unknown,2,3
152832,201509160008,2015,9,16,Afghanistan,South Asia,Herat,Guzara district,34.19899,62.220732999999996,"09/16/2015: Assailants abducted four Etisalat Telecommunication Company contractors in Guzara district, Herat province, Afghanistan. One of the hostages was killed on an unspecified date, while the remaining three hostages were killed after briefly escaping on September 18, 2015. No group claimed responsibility for the incident; however, sources attributed the abduction to the Taliban.",Business,Taliban,Firearms,4,0
152834,201509160010,2015,9,16,Afghanistan,South Asia,Kabul,Paghman district,34.591139,68.957643,"09/16/2015: A suicide bomber detonated an explosives-laden vehicle at a district administration building in Paghman district, Kabul province, Afghanistan. In addition to the bomber, four people, including the Criminal Investigation Department (CID) district chief, were killed and 41 others were injured in the blast. The Taliban claimed responsibility for the incident.",Government (General),Taliban,Explosives/Bombs/Dynamite,5,41
152841,201509160023,2015,9,16,Afghanistan,South Asia,Paktia,Kolagu,33.453551000000004,68.887283,"09/16/2015: Assailants fired mortars at an Afghan National Army (ANA) base in Kolalgu area, Zurmat district, Paktia province, Afghanistan. Nine civilians were killed and 65 assailants were killed in the ensuing clash. The Taliban claimed responsibility for the incident.",Military,Taliban,Explosives/Bombs/Dynamite,74,0
152847,201509160035,2015,9,16,Afghanistan,South Asia,Uruzgan,Khas Uruzgan district,32.937715000000004,66.687686,"09/16/2015: Assailants attacked a police headquarters in Khas Uruzgan district, Uruzgan province, Afghanistan. A police officer was killed and four others were injured in the attack. The Taliban claimed responsibility for the incident.",Police,Taliban,Unknown,1,4
152853,201509160074,2015,9,16,Afghanistan,South Asia,Balkh,Chimtal district,36.677784,66.67495699999999,"09/16/2015: An explosive device detonated near a police vehicle in Cheshma area, Chimtal district, Balkh province, Afghanistan. At least four officers were injured in the blast. The Taliban claimed responsibility for the attack.",Police,Taliban,Explosives/Bombs/Dynamite,0,4
152859,201509160085,2015,9,16,Afghanistan,South Asia,Herat,Du Dana Gholam Ali Khan,35.140411,61.711523,"09/16/2015: Assailants opened fire on a civilian van in Du Dana Gholam Ali Khan, Gulran district, Herat province, Afghanistan. At least four people were killed and 12 others were injured in the assault. No group claimed responsibility for the attack.",Private Citizens & Property,Unknown,Firearms,4,12
152876,201509170028,2015,9,17,Afghanistan,South Asia,Farah,Farah district,32.362353000000006,62.129948999999996,"09/17/2015: Assailants attacked a police post on the Herat-Farah highway in Farah province, Afghanistan. This is one of two related attacks on security posts in Farah province on this date. Six police officers were killed and twelve others were wounded across the two attacks. The Taliban claimed responsibility for the attacks.",Police,Taliban,Unknown,3,6
152877,201509170029,2015,9,17,Afghanistan,South Asia,Farah,Farah district,32.362353000000006,62.129948999999996,"09/17/2015: Assailants attacked a police post on the Herat-Farah highway in Farah province, Afghanistan. This is one of two related attacks on security posts in Farah province on this date. Six police officers were killed and twelve others were wounded across the two attacks. The Taliban claimed responsibility for the attacks.",Police,Taliban,Unknown,3,6
152878,201509170030,2015,9,16,Afghanistan,South Asia,Kandahar,Kandahar,31.516547999999997,65.87055699999999,"09/16/2015: A suicide bomber on an explosives-laden motorcycle detonated targeting a North Atlantic Treaty Organization (NATO) convoy on Kandahar-Spin Boldak road in Kandahar province, Afghanistan. One civilian was wounded in the blast. The Taliban claimed responsibility for the incident.",Military,Taliban,Explosives/Bombs/Dynamite,1,1
152883,201509170046,2015,9,17,Afghanistan,South Asia,Badakhshan,Faizabad,37.102846,70.559314,"09/17/2015: A hand grenade detonated at the residence of Yama Behroz in Faizabad city, Badakhshan province, Afghanistan. Behroz, a journalist, was killed in the blast. No group claimed responsibility for the incident.",Journalists & Media,Unknown,Explosives/Bombs/Dynamite,1,0
152894,201509170071,2015,9,15,Afghanistan,South Asia,Helmand,Kajaki district,32.284569,65.064875,"09/15/2015: Assailants attacked security posts in Kajaki district, Helmand province, Afghanistan. At least 20 assailants were killed and 35 others were injured in the incident. The Taliban claimed responsibility for the attack.",Military,Taliban,Unknown,20,35
152895,201509170076,2015,9,17,Afghanistan,South Asia,Faryab,Pahlawan Tash,35.939516,64.924174,"09/17/2015: Assailants opened fire on at a civilian vehicle in Pahlawan Tash, Faryab province, Afghanistan. At least one person was killed and four others were injured in the assault. No group claimed responsibility; however, sources attributed the attack to the Taliban.",Private Citizens & Property,Taliban,Firearms,1,4
152905,201509180008,2015,9,18,Afghanistan,South Asia,Kandahar,Haji Qul,31.966072999999998,65.53099,"09/18/2015: Assailants attacked an Afghan National Police (ANP) checkpoint in Haji Qul area, Khakrez district, Kandahar province, Afghanistan. Two police officers and an assailant were killed and a police officer was injured in the ensuing clash. The Taliban claimed responsibility for the incident.",Police,Taliban,Firearms,3,1
152906,201509180009,2015,9,18,Afghanistan,South Asia,Kandahar,Maywand district,31.622276,65.05454300000001,"09/18/2015: Assailants attacked police officers in Maywand district, Kandahar province, Afghanistan. A police officer was killed and another was injured in the attack; the assailants also sustained an unspecified number of casualties in the clash. The Taliban claimed responsibility for the incident.",Police,Taliban,Unknown,1,1
152907,201509180010,2015,9,18,Afghanistan,South Asia,Zabul,Arghandab district,32.342871,66.685427,"09/18/2015: Assailants poisoned the food that police officers were eating at a checkpost in Arghandab district, Zabul province, Afghanistan. Eight police officers were killed in the attack. The Taliban claimed responsibility for the incident.",Police,Taliban,Chemical,8,0
152908,201509180012,2015,9,18,Afghanistan,South Asia,Kabul,Khaki Jabar district,34.324145,69.408388,"09/18/2015: A landmine detonated targeting a civilian in Khaki Jabar district, Kabul province, Afghanistan. Four civilians were killed and seven others were injured in the blast. No group claimed responsibility for the incident.",Private Citizens & Property,Unknown,Explosives/Bombs/Dynamite,4,7
152909,201509180013,2015,9,18,Afghanistan,South Asia,Kunar,Chapa Dara district,34.957190999999995,70.749937,"09/18/2015: Assailants attacked the family members of a local police commander in Chapa Dara district, Kunar province, Afghanistan. The commander's son and nephew were killed and another relative was injured in the attack. No group claimed responsibility for the incident; however, sources attributed the attack to the Taliban.",Police,Taliban,Firearms,2,1
152914,201509180027,2015,9,18,Afghanistan,South Asia,Badakhshan,Tasira,37.066629999999996,71.13161600000001,"09/18/2015: Assailants attacked a police checkpoint in Tasira area, Baharak district, Badakhshan province, Afghanistan. Six police officers were killed in the attack. The Taliban claimed responsibility for the incident.",Police,Taliban,Unknown,6,0
152940,201509190004,2015,9,19,Afghanistan,South Asia,Ghazni,Khani,33.318492,68.452609,"09/19/2015: Assailants abducted five civilians from Khani area, Andar district, Ghazni province, Afghanistan. The hostages were released on September 20, 2015. No group claimed responsibility for the incident; however, sources attributed the abduction to the Taliban.",Private Citizens & Property,Taliban,Unknown,0,0
152953,201509190033,2015,9,19,Afghanistan,South Asia,Logar,Khezar,34.000668,69.023003,"09/19/2015: An explosive device attached to an oil tanker detonated targeting an Afghanistan National Civil Order Police (ANCOP) convoy in Khezar bazaar, Logar province, Afghanistan. There were no reported casualties in the blast. No group claimed responsibility for the incident.",Police,Unknown,Explosives/Bombs/Dynamite,0,0
152971,201509190094,2015,9,19,Afghanistan,South Asia,Jawzjan,She Shanbe Tepah,36.487302,65.790897,"09/19/2015: Assailants abducted five people on the Jowzjan-Sar-e Pul highway in She Shanbe Tepah, Jawzjan Province, Afghanistan. The outcome of the kidnapping is unknown. No group claimed responsibility; however, sources attributed the attack to the Taliban.",Private Citizens & Property,Taliban,Unknown,0,0
152972,201509190097,2015,9,19,Afghanistan,South Asia,Ghazni,Andar district,33.317496000000006,68.450117,"09/19/2015: Mortars struck a residential area in Andar district, Ghazni province, Afghanistan. This was one of two similar attacks in the province on the same day. At least two people killed and eight people were injured across both assaults. No group claimed responsibility for the incidents.",Private Citizens & Property,Unknown,Explosives/Bombs/Dynamite,1,4
152973,201509190098,2015,9,19,Afghanistan,South Asia,Ghazni,Dih Yak district,33.480459,68.675024,"09/19/2015: Mortars struck a residential area in Andar district, Ghazni province, Afghanistan. This was one of two similar attacks in the province on the same day. At least two people killed and eight people were injured across both assaults. No group claimed responsibility for the incidents.",Private Citizens & Property,Unknown,Explosives/Bombs/Dynamite,1,4
152986,201509200017,2015,9,20,Afghanistan,South Asia,Kandahar,Daman district,31.129303999999998,65.765101,"09/20/2015: A suicide bomber detonated explosives-laden vehicle at a police checkpost in Daman district, Kandahar province, Afghanistan. The assailant was killed and two police officers and a civilian were injured in the blast. The Taliban claimed responsibility for the incident.",Police,Taliban,Explosives/Bombs/Dynamite,1,3
152987,201509200018,2015,9,20,Afghanistan,South Asia,Kandahar,Qandi,32.395693,65.716298,"09/20/2015: An explosive device detonated after it was struck by a civilian vehicle in Qandi village, Nesh district, Kandahar province, Afghanistan. Two civilians were killed and one was injured in the blast. No group claimed responsibility for the incident.",Private Citizens & Property,Unknown,Explosives/Bombs/Dynamite,2,1
152995,201509200054,2015,9,20,Afghanistan,South Asia,Samangan,Abyak,36.265456,68.021336,"09/20/2015: An explosives-laden motorcycle detonated near an Afghan Police vehicle in Abyak city, Samangan province, Afghanistan. At least five civilians were injured in the blast. No group claimed responsibility for the incident; however, sources attributed the attack to the Taliban.",Police,Taliban,Explosives/Bombs/Dynamite,0,5
152997,201509200058,2015,9,19,Afghanistan,South Asia,Paktia,Zurmat district,33.499989,69.09870699999999,"09/19/2015: A roadside bomb detonated targeting a police vehicle in Zurmat district, Paktia province, Afghanistan. Five police officers were killed in the blast. No group claimed responsibility for the incident; however, officials attributed the attack to the Taliban.",Police,Taliban,Explosives/Bombs/Dynamite,5,0
152998,201509200059,2015,9,20,Afghanistan,South Asia,Kunar,Asadabad,34.874165999999995,71.152396,"09/20/2015: An explosive device detonated at a market in Asadabad city, Kunar province, Afghanistan. At least 28 civilians were injured in the blast. No group claimed responsibility for the incident; however, officials attributed the attack to the Taliban.",Private Citizens & Property,Taliban,Explosives/Bombs/Dynamite,0,28
152999,201509200063,2015,9,20,Afghanistan,South Asia,Baghlan,Baghlani Jadid district,36.175740000000005,68.753606,"09/20/2015: Assailants set fire to a military base in Baghlani Jadid district, Baghlan province, Afghanistan. There were no reported casualties in the attack. No group claimed responsibility for the incident; however, sources attributed the attack to the Taliban.",Military,Taliban,Incendiary,0,0
153006,201509200074,2015,9,20,Afghanistan,South Asia,Herat,Sewshan,34.227745,62.281240000000004,"09/20/2015: Assailants shot and killed tribal elder Haji Boor in Sewshan area, Guzara district, Herat province, Afghanistan. No group claimed responsibility for the incident.",Private Citizens & Property,Unknown,Firearms,1,0
153010,201509200082,2015,9,20,Afghanistan,South Asia,Logar,Puli Alam,34.00038,69.018998,"09/20/2015: Assailants opened fire on Maulvi Nazeer in Puli Alam, Logar province, Afghanistan. Nazeer, a religious cleric, was killed and another individual was wounded in the attack. No group claimed responsibility for the attack.",Religious Figures/Institutions,Unknown,Firearms,1,1
153011,201509200085,2015,9,20,Afghanistan,South Asia,Herat,Rabat Akhund,34.282591,63.010957999999995,"09/20/2015: Assailants attacked an Afghan National Civil Order Police (ANCOP) checkpoint in Rabat Akhund area, Herat, Afghanistan. Two assailants were killed and three assailants were injured in the ensuing clash. No group claimed responsibility for the incident; however, sources attributed the attack to the Taliban.",Police,Taliban,Unknown,2,3
153029,201509210005,2015,9,21,Afghanistan,South Asia,Ghazni,Ali Kala,33.417794,68.573075,"09/21/2015: Assailants fired a rocket into Ali Kala village, Dih Yak district, Ghazni province, Afghanistan. One civilian was killed and five others were injured in the attack. No group claimed responsibility for the incident; however, sources attributed the attack to the Taliban.",Private Citizens & Property,Taliban,Explosives/Bombs/Dynamite,1,5
153051,201509210044,2015,9,21,Afghanistan,South Asia,Sari Pul,Sari Pul district,36.358403,65.86631,"09/21/2015: Assailants abducted four people, including two farmers and two children Sari Pul district, Sari Pul province, Afghanistan. The two children were released on September 22, 2015, while the two farmers were killed. No group claimed responsibility; however, sources attributed the attack to the Taliban.",Private Citizens & Property,Taliban,Firearms,2,0
153057,201509210054,2015,9,21,Afghanistan,South Asia,Sari Pul,Unknown,36.212506,65.931014,"09/21/2015: Assailants abducted a woman in Sari Pul province, Afghanistan. The woman was stoned on the following day, but survived the attempted execution. No group claimed responsibility; however, sources attributed the attack to the Taliban.",Private Citizens & Property,Taliban,Other,0,1
153069,201509220006,2015,9,22,Afghanistan,South Asia,Jawzjan,Fayzabad district,36.743125,66.451436,"09/22/2015: Assailants armed with grenades and firearms attacked an Afghan National Army (ANA) checkpoint in Qush Tapa area, Jawzjan province, Afghanistan. At least 10 soldiers were killed in the attack. The Taliban claimed responsibility for the incident.",Military,Taliban,Explosives/Bombs/Dynamite,10,0
153070,201509220007,2015,9,22,Afghanistan,South Asia,Balkh,Dawlatabad district,36.989115000000005,66.815963,"09/22/2015: An explosive device detonated targeting the vehicle of Sabawon Rogh in Qaltak Shah area, Dawlatabad district, Balkh province, Afghanistan. Rogh, a district police chief, and four police officers were killed and three officers were injured in the blast. The Taliban claimed responsibility for the incident.",Police,Taliban,Explosives/Bombs/Dynamite,5,3
153079,201509220038,2015,9,22,Afghanistan,South Asia,Parwan,Bagram,34.941297,69.263318,"09/22/2015: Assailants fired a rocket at North Atlantic Treaty Organization (NATO) forces near Bagram Airbase, Parwan province, Afghanistan. A Georgian soldier was killed and a second soldier was injured in the attack. The Taliban claimed responsibility for the incident.",Military,Taliban,Explosives/Bombs/Dynamite,1,1
153080,201509220039,2015,9,22,Afghanistan,South Asia,Badakhshan,Tagab district,36.460389,70.33105,"09/22/2015: An explosive device detonated near the district chief's office in Tagab district, Badakhshan province, Afghanistan. Two relatives of Tahir Khan Sapai, an advisor to former president Hamid Karzai, were wounded in the attack. No group claimed responsibility for the incident.",Government (General),Unknown,Explosives/Bombs/Dynamite,0,2
153082,201509220041,2015,9,22,Afghanistan,South Asia,Kabul,Kabul,34.555349,69.207486,"09/22/2015: Security forces discovered and defused an explosives-laden motorcycle in Kabul city, Kabul province, Afghanistan. No group claimed responsibility for the incident.",Unknown,Unknown,Explosives/Bombs/Dynamite,0,0
153106,201509230033,2015,9,23,Afghanistan,South Asia,Paktika,Omna district,32.889975,68.822226,"09/23/2015: An explosive device detonated targeting the convoy of Nisar Ahmad Rahimzai in Omna district, Paktika province, Afghanistan. Two police officers were killed and four others, including a deputy police chief, were injured in the blast. The Taliban claimed responsibility for the incident.",Police,Taliban,Explosives/Bombs/Dynamite,2,4
153107,201509230034,2015,9,23,Afghanistan,South Asia,Paktika,Omna district,32.970488,68.812742,"09/23/2015: A roadside bomb detonated in Ginawa area, Omna district, Paktika province, Afghanistan. A civilian was killed in the blast. No group claimed responsibility for the incident.",Private Citizens & Property,Unknown,Explosives/Bombs/Dynamite,1,0
153111,201509230039,2015,9,23,Afghanistan,South Asia,Nangarhar,Lagharjo,34.1057,70.53043100000001,"09/23/2015: A roadside bomb detonated prematurely as assailants were planting it in Lagharjo area, Kot district, Nangarhar province, Afghanistan. Eight assailants were killed and four others were injured in the blast. The Khorasan Chapter of the Islamic State claimed responsibility for the incident.",Unknown,Khorasan Chapter of the Islamic State,Explosives/Bombs/Dynamite,8,4
