,id,year,month,day,country,region,state,city,latitude,longitude,summary,target,tgroup,weapon,fatalities,injuries
149343,201506220006,2015,6,22,Afghanistan,South Asia,Kabul,Kabul,34.499493,69.142336,"06/22/2015: A suicide bomber detonated an explosives-laden vehicle and six other assailants attacked the Afghan parliament building in Kabul city, Kabul province, Afghanistan. At least nine people, including all seven assailants, were killed and 31 others were injured in the attack. The Taliban claimed responsibility for the incident and stated that the attack was intended to disrupt a government gathering, in which Afghanistan's newly appointed defense minister was going to be introduced; an Afghan official also attributed the attack to the Haqqani Network.",Government (General),Taliban,Explosives/Bombs/Dynamite,9,31
149353,201506220024,2015,6,22,Afghanistan,South Asia,Herat,Chishti Sharif district,34.340314,63.751137,"06/22/2015: Assailants abducted Ihsanullah Sadaat and his driver in Chishti Sharif district, Herat province, Afghanistan. Sadaat, a district executive director, was released on July 8, 2015, while the fate of the other hostage is unknown. No group claimed responsibility for the incident; however, sources attributed the abduction to the Taliban.",Government (General),Taliban,Unknown,0,0
149354,201506220025,2015,6,22,Afghanistan,South Asia,Baghlan,Hazhdar Kotal,36.003598,68.66712700000001,"06/22/2015: An explosive device detonated near a police vehicle in Hazhdar Kotal area, Puli Khumri city, Baghlan province, Afghanistan. Two police officers were killed in the blast. No group claimed responsibility for the incident.",Police,Unknown,Explosives/Bombs/Dynamite,2,0
149355,201506220026,2015,6,22,Afghanistan,South Asia,Kabul,Kabul,34.552087,69.15615,"06/22/2015: Assailants abducted Anja de Beer, the country director for an international NGO, in Taimani area, Kabul city, Kabul province, Afghanistan. De Beer was released unharmed on September 10, 2015. No group claimed responsibility for the incident.",NGO,Unknown,Firearms,0,0
149367,201506220040,2015,6,22,Afghanistan,South Asia,Baghlan,Baghlani Jadid district,36.176504,68.74937299999999,"06/22/2015: Assailants attacked police posts in Baghlani Jadid district, Baghlan province, Afghanistan. Five assailants were killed in ensuing clash. No group claimed responsibility for the incident; however, sources attributed the attack to the Taliban.",Police,Taliban,Unknown,5,0
149369,201506220043,2015,6,22,Afghanistan,South Asia,Khost,Tani district,33.241541999999995,69.828722,"06/22/2015: Assailants attacked Dilawar Shah in Tani district, eastern Khost province, Afghanistan. Shah, a former militant, and his two sons were killed in the attack. No group claimed responsibility for the incident.",Private Citizens & Property,Unknown,Firearms,3,0
149378,201506220085,2015,6,22,Afghanistan,South Asia,Kunar,Daridam,34.872248,71.216922,"06/22/2015: Assailants fired projectiles at a residential area in Daridam area, Kunar province, Afghanistan. One civilian was killed and three others were injured in the attack. No group claimed responsibility for the incident.",Private Citizens & Property,Unknown,Explosives/Bombs/Dynamite,1,3
149379,201506220086,2015,6,22,Afghanistan,South Asia,Kunar,Daridam,34.872248,71.216922,"06/22/2015: Assailants opened fire on civilians in Daridam area, Kunar province, Afghanistan. Two civilians were injured in the attack. No group claimed responsibility for the incident.",Private Citizens & Property,Unknown,Firearms,0,2
149409,201506230043,2015,6,23,Afghanistan,South Asia,Herat,Islam Kala,34.659191,61.113893999999995,"06/23/2015: Assailants abducted Jawad in Islam Kala area, Herat province, Afghanistan. Jawad, an Iranian oil tank driver was released on June 28, 2015. No group claimed responsibility for the incident.",Private Citizens & Property,Unknown,Firearms,0,0
149410,201506230044,2015,6,23,Afghanistan,South Asia,Herat,Shindand district,33.310225,62.164469999999994,"06/23/2015: Assailants abducted Mohammad Qasim, a school headmaster, in Shindand district, Herat province, Afghanistan. The outcome of the abduction is unknown. No group claimed responsibility for the incident.",Educational Institution,Unknown,Firearms,0,0
149413,201506230049,2015,6,23,Afghanistan,South Asia,Nimroz,Chakhansur district,31.314139,62.301835,"06/23/2015: Assailants opened fire on Haji Hakim Gulabzay in Chakhansur district, Nimroz province, Afghanistan. Gulabzay, a mullah of Noori Grand Mosque, was killed in the attack. The Taliban claimed responsibility for the incident.",Religious Figures/Institutions,Taliban,Firearms,1,0
149417,201506230068,2015,6,23,Afghanistan,South Asia,Badghis,Darae Bum,35.122299,63.462485,"06/23/2015: Assailants opened fire on an Afghan National Civil Order Police (ANCOP) officer in Darae Bum area, Qadis district, Badghis province, Afghanistan. The officer was killed in the attack. No group claimed responsibility for the incident; however, sources attributed the attack to the Taliban.",Police,Taliban,Firearms,1,0
149423,201506230094,2015,6,23,Afghanistan,South Asia,Uruzgan,Khas Uruzgan district,33.025068,66.712915,"06/23/2015: Assailants abducted Muhammad Qasim, Asadullah, and Niamatullah, three senior district officials, in Khas Uruzgan district, Uruzgan province, Afghanistan. The outcome of the abduction is unknown. No group claimed responsibility for the incident; however, sources attributed the abduction to the Taliban.",Government (General),Taliban,Unknown,0,0
149435,201506240025,2015,6,24,Afghanistan,South Asia,Badakhshan,Keshem district,36.816573999999996,70.100768,"06/24/2015: An explosive device detonated near Abdul Jabar Mussadiq in Keshem district, Badakhshan province, Afghanistan. Mussadiq, a district governor, was killed in the attack. The Taliban claimed responsibility for the incident.",Government (General),Taliban,Explosives/Bombs/Dynamite,1,0
149443,201506240046,2015,6,24,Afghanistan,South Asia,Jawzjan,Unknown,36.311448999999996,65.486964,"06/24/2015: Assailants abducted two construction workers and their driver in Shibirghan-Qush Tepa highway area, Jawzjan province, Afghanistan. All three victims were killed the same day. No group claimed responsibility for the incident; however, sources attributed the attack to the Taliban.",Business,Taliban,Firearms,3,0
149444,201506240047,2015,6,24,Afghanistan,South Asia,Jawzjan,Unknown,36.887825,65.679163,"06/24/2015: Assailants set fire to two construction vehicles in Jawzjan province, Afghanistan. There were no reported casualties in the attack. No group claimed responsibility for the incident.",Business,Unknown,Incendiary,0,0
149450,201506240060,2015,6,24,Afghanistan,South Asia,Badghis,Tash Balaq,34.838621,62.879431000000004,"06/24/2015: An explosive device detonated in Tash Balaq area, Ab Kamari district, Badghis province, Afghanistan. One person was killed in the attack. No group claimed responsibility for the incident.",Private Citizens & Property,Unknown,Explosives/Bombs/Dynamite,1,0
149476,201506250052,2015,6,25,Afghanistan,South Asia,Nuristan,Waygal district,35.183083,70.986575,"06/25/2015: Assailants attacked Waygal district, Nuristan province, Afghanistan. 38 people, including 20 assailants, were killed and 54 others, including 24 assailants, were injured in the ensuing clash. The Taliban claimed responsibility for the incident.",Government (General),Taliban,Firearms,38,54
149477,201506250053,2015,6,25,Afghanistan,South Asia,Takhar,Khwaja Ghar district,37.067603000000005,69.42229300000001,"06/25/2015: Assailants opened fire on a police checkpoint in Khwaja Ghar district, Takhar province, Afghanistan. This was one of three related attacks targeting police checkposts in Khwaja Ghar district on June 25, 2015. Ten people, including seven assailants and three police officers, were killed across attacks. The Taliban claimed responsibility for the incident.",Police,Taliban,Firearms,4,0
149478,201506250056,2015,6,25,Afghanistan,South Asia,Nimroz,Delaram district,32.164103999999995,63.424597,"06/25/2015: Assailants launched a rocket at a police ammunitions depot in Delaram district, Nimroz province, Afghanistan. Twelve police officers were injured in the attack. No group claimed responsibility for the incident.",Police,Unknown,Explosives/Bombs/Dynamite,0,12
149479,201506250057,2015,6,25,Afghanistan,South Asia,Helmand,Zamboli,31.853892,64.709583,"06/25/2015: Assailants attacked Afghan National Army (ANA), Afghan National Police (ANP) and Afghan Local Police (ALP) checkposts in Zanbali, Helmand province, Afghanistan. At least 27 people, including 15 assailants, were killed and 19 others, including ten assailants, were injured in the ensuing clash. The Taliban claimed responsibility for the incident.",Military,Taliban,Firearms,27,19
149480,201506250058,2015,6,24,Afghanistan,South Asia,Laghman,Unknown,34.689769,70.145581,"06/24/2015: Assailants opened fire on the residence of Sayed Hasan Almas in Laghman province, Afghanistan. Six assailants were killed and two people, including an assailant, were wounded in the attack. No group claimed responsibility for the incident; however, sources attributed the attack to the Taliban.",Police,Taliban,Firearms,6,2
149481,201506250061,2015,6,25,Afghanistan,South Asia,Nangarhar,Lal Por district,34.351851,70.957542,"06/25/2015: Assailants attempted to hijack a civilian vehicle in Lal Por district, Nangarhar province, Afghanistan. Nine assailants were killed and three others were injured in the attack. No group claimed responsibility for the incident; however, sources attributed the attack to the Taliban.",Private Citizens & Property,Taliban,Firearms,9,3
149484,201506250068,2015,6,25,Afghanistan,South Asia,Takhar,Khwaja Ghar district,37.068304,69.42273,"06/25/2015: Assailants opened fire on a police checkpoint in Khwaja Ghar district, Takhar province, Afghanistan. This was one of three related attacks targeting police checkposts in Khwaja Ghar district on June 25, 2015. Ten people, including seven assailants and three police officers, were killed across attacks. The Taliban claimed responsibility for the incident.",Police,Taliban,Firearms,3,0
149485,201506250069,2015,6,25,Afghanistan,South Asia,Takhar,Khwaja Ghar district,37.069006,69.424042,"06/25/2015: Assailants opened fire on a police checkpoint in Khwaja Ghar district, Takhar province, Afghanistan. This was one of three related attacks targeting police checkposts in Khwaja Ghar district on June 25, 2015. Ten people, including seven assailants and three police officers, were killed across attacks. The Taliban claimed responsibility for the incident.",Police,Taliban,Firearms,3,0
149505,201506260021,2015,6,26,Afghanistan,South Asia,Zabul,Shahjoy district,32.518926,67.440718,"06/26/2015: An explosive device detonated in Shahjoy district, Zabul province, Afghanistan. Three civilians were injured in the blast. No group claimed responsibility for the incident.",Private Citizens & Property,Unknown,Explosives/Bombs/Dynamite,0,3
149506,201506260022,2015,6,27,Afghanistan,South Asia,Laghman,Islamabad,34.753465999999996,70.103037,"06/27/2015: An explosive device detonated near a police vehicle in Islamabad city, Alishing district, Laghman province, Afghanistan. Two people, including a police officer, were killed and one other was wounded in the blast. No group claimed responsibility for the incident.",Police,Unknown,Explosives/Bombs/Dynamite,2,1
149516,201506260039,2015,6,26,Afghanistan,South Asia,Uruzgan,Shahley Nawa,32.917796,66.719635,"06/26/2015: Assailants opened fire on police checkposts in Shahley Nawa area, Khas Uruzgan district, Uruzgan province, Afghanistan. Six people, including two police officers and four assailants, were killed and three police officers were injured in the ensuing clash, which lasted until June 28, 2015. The Taliban claimed responsibility for the incident.",Police,Taliban,Firearms,6,3
149523,201506260056,2015,6,26,Afghanistan,South Asia,Badakhshan,Baharak district,36.999475,70.891751,"06/26/2015: Assailants fired three rockets at a district headquarters in Baharak district, Badakhshan province, Afghanistan. There were no reported casualties in the attack. No group claimed responsibility for the incident.",Government (General),Unknown,Explosives/Bombs/Dynamite,0,0
149525,201506260058,2015,6,26,Afghanistan,South Asia,Kunduz,Aliabad district,36.510918,68.903288,"06/26/2015: Assailants opened fire on an Afghan Local Police (ALP) checkpost in Aliabad district, Kunduz province, Afghanistan. Eleven assailants were killed and nine others, including a police officer and eight assailants, were injured in the ensuing clash. No group claimed responsibility for the incident; however, sources attributed the attack to the Taliban.",Police,Taliban,Firearms,11,9
149549,201506270031,2015,6,27,Afghanistan,South Asia,Bamyan,Shibar district,34.936939,68.098635,"06/27/2015: Assailants launched five rockets and opened fire on the convoy of Mohammad Azim Farid in Shibar district, Bamyan province, Afghanistan. Farid, a district chief, was unharmed in the attack. The Taliban claimed responsibility for the incident.",Government (General),Taliban,Explosives/Bombs/Dynamite,0,0
149550,201506270032,2015,6,27,Afghanistan,South Asia,Faryab,Khwaja Sabz Posh district,36.024784999999994,64.873074,"06/27/2015: An explosive device planted in the vehicle of Nader Padshah detonated in Khwaja Sabz Posh district, Faryab province, Afghanistan. Padshah, a National Islamic Movement of Afghanistan commander, and his son were killed and two others were injured in the blast. No group claimed responsibility for the incident.",Violent Political Party,Unknown,Explosives/Bombs/Dynamite,2,2
149551,201506270033,2015,6,27,Afghanistan,South Asia,Kunduz,Chahar Dara district,36.697845,68.78184399999999,"06/27/2015: An unknown number of explosive devices were discovered and safely defused in Chahar Dara district, Kunduz province, Afghanistan. No group claimed responsibility for the incident; however, sources attributed the attempted attack to the Taliban.",Unknown,Taliban,Explosives/Bombs/Dynamite,0,0
149555,201506270071,2015,6,27,Afghanistan,South Asia,Ghazni,Ghazni,33.545059,68.417397,"06/27/2015: Assailants attacked police personnel in Ghazni city, Ghazni province, Afghanistan. A police officer was killed and one other was injured in the attack. No group claimed responsibility for the incident.",Police,Unknown,Firearms,1,1
149572,201506280050,2015,6,28,Afghanistan,South Asia,Kandahar,Sozyano,32.122568,65.87634200000001,"06/28/2015: An explosive device detonated as it was being planted in Sozyano, Shah Wali Kot district, Kandahar province, Afghanistan. At least three assailants were killed in the blast. No group claimed responsibility; however, sources attributed the attack to the Taliban.",Unknown,Taliban,Explosives/Bombs/Dynamite,3,0
149583,201506280066,2015,6,28,Afghanistan,South Asia,Ghazni,Gelan district,32.674263,67.71581,"06/28/2015: Assailants abducted five family members in Gelan district, Ghazni province, Afghanistan. The outcome of the kidnapping is unknown. No group claimed responsibility for the attack.",Private Citizens & Property,Unknown,Firearms,0,0
149584,201506280067,2015,6,28,Afghanistan,South Asia,Kandahar,Kandahar,31.620693,65.682692,"06/28/2015: An assailant opened fire on Afghan Police officers in Zone II neighborhood, Kandahar city, Kandahar province, Afghanistan. At least three people, including two officers and the assailant, were killed in the assault. No group claimed responsibility for the attack.",Police,Unknown,Firearms,3,0
149585,201506280068,2015,6,28,Afghanistan,South Asia,Ghazni,Unknown,33.545059,68.417397,"06/28/2015: Assailants abducted three drivers in Ghazni province, Afghanistan. All three hostages were released shortly after the kidnapping. No group claimed responsibility for the attack.",Private Citizens & Property,Unknown,Unknown,0,0
149587,201506280070,2015,6,28,Afghanistan,South Asia,Kandahar,Garmawak,31.800593,65.062241,"06/28/2015: Assailants shot down an Afghan National Army (ANA) aircraft in Garmawak, Kandahar province, Afghanistan. At least three soldiers were killed and others were wounded in the attack. No group claimed responsibility for the incident.",Military,Unknown,Explosives/Bombs/Dynamite,3,0
149597,201506280114,2015,6,28,Afghanistan,South Asia,Nangarhar,Ghani Khel,34.195301,70.799971,"06/28/2015: Assailants beheaded a civilian accused of spying for the government in Ghani Khel, Nangarhar province, Afghanistan. The Khorasan Chapter of the Islamic State claimed responsibility for the attack.",Private Citizens & Property,Khorasan Chapter of the Islamic State,Melee,1,0
149599,201506290001,2015,6,29,Afghanistan,South Asia,Herat,Masjed-e Chubi,34.571845,63.087258999999996,"06/29/2015: Assailants opened fire on an Afghan National Army (ANA) convoy in Masjed-e Chubi, Karukh district, Herat province, Afghanistan. At least 18 people, including 11 soldiers and seven assailants, were killed and 11 others, including six ANA soldiers and five assailants, were injured in the assault. No group claimed responsibility; however, officials attributed the attack to the Taliban.",Military,Taliban,Firearms,18,11
149611,201506290017,2015,6,29,Afghanistan,South Asia,Uruzgan,Deh Rahwod district,32.651638,65.460736,"06/29/2015: Assailants fired a mortar that struck a civilian residence in Deh Rahwod district, Uruzgan province, Afghanistan. At least 12 people were injured in the blast. No group claimed responsibility; however, officials attributed the attack to the Taliban.",Private Citizens & Property,Taliban,Explosives/Bombs/Dynamite,0,12
149624,201506290036,2015,6,29,Afghanistan,South Asia,Kunduz,Lala Maydan,36.510349,68.879696,"06/29/2015: Assailants opened fire on a mosque in Lala Maydan, Aliabad district, Kunduz province, Afghanistan. At least two people were killed and another was injured in the assault. No group claimed responsibility for the attack.",Religious Figures/Institutions,Unknown,Firearms,2,1
149625,201506290037,2015,6,29,Afghanistan,South Asia,Badakhshan,Darayim district,36.877434,70.466619,"06/29/2015: Assailants opened fire on Ahmad Naveed Ferotan in Darayim district, Badakhshan province, Afghanistan. Ferotan, a former jihadi commander, was killed in the assault. No group claimed responsibility; however, sources suspected that the attack was carried out by the Taliban.",Private Citizens & Property,Taliban,Firearms,1,0
149630,201506290051,2015,6,29,Afghanistan,South Asia,Takhar,Nur Khail,37.383558,69.43774,"06/29/2015: Assailants opened fire on an Afghan Local Police (ALP) checkpost in Nur Khail, Darqad district, Takhar province, Afghanistan. At least four people, including three officers and one assailant, were killed and eight others, including one officer and seven assailants, were injured in the assault. No group claimed responsibility; however, sources attributed the incident to the Taliban.",Police,Taliban,Firearms,4,8
149631,201506290053,2015,6,29,Afghanistan,South Asia,Uruzgan,Tarin Kot,32.623655,65.875085,"06/29/2015: An explosive device detonated near the vehicle of an Afghan Police post commander in Tarin Kot city, Uruzgan province, Afghanistan. At least four people were injured in the blast. No group claimed responsibility for the attack.",Police,Unknown,Explosives/Bombs/Dynamite,0,4
149632,201506290054,2015,6,29,Afghanistan,South Asia,Uruzgan,Tarin Kot,32.631262,65.879269,"06/29/2015: An explosive device attached to an Afghan Police vehicle detonated in Tarin Kot city, Uruzgan province, Afghanistan. At least four people, including three police officers, were injured in the blast. No group claimed responsibility for the attack.",Police,Unknown,Explosives/Bombs/Dynamite,0,4
149648,201506300011,2015,6,30,Afghanistan,South Asia,Kabul,Kabul,34.548509,69.199967,"06/30/2015: A suicide bomber detonated an explosives-laden vehicle near a North Atlantic Treaty Organization (NATO) Operation Resolute Support convoy along Airport Road in Kabul city, Kabul province, Afghanistan. In addition to the bomber, at least two people were killed and 24 others, including two soldiers from the United States, were wounded in the blast. The Taliban claimed responsibility for the attack.",Military,Taliban,Explosives/Bombs/Dynamite,3,24
149649,201506300012,2015,6,30,Afghanistan,South Asia,Helmand,Lashkar Gah,31.599042999999998,64.37583599999999,"06/30/2015: A suicide bomber detonated an explosives laden vehicle near the boundary wall of the Afghan Police Headquarters in Lashkar Gah city, Helmand province, Afghanistan. A second suicide bomber was killed prior to entering the headquarters. In addition to the two bombers, at least two people were killed and 51 others were injured in the blast. The Taliban claimed responsibility for the attack.",Police,Taliban,Explosives/Bombs/Dynamite,4,51
149651,201506300014,2015,6,30,Afghanistan,South Asia,Paktia,Ebrahim Khel,33.530116,69.133082,"06/30/2015: An explosive device detonated near a civilian vehicle in Ebrahim Khel, Paktia province, Afghanistan. At least three people were killed and another was injured in the blast. No group claimed responsibility for the attack.",Private Citizens & Property,Unknown,Explosives/Bombs/Dynamite,3,1
149652,201506300015,2015,6,30,Afghanistan,South Asia,Kabul,Kabul,34.511154,69.226675,"06/30/2015: An explosive device attached to an Afghan National Security Force (ANSF) vehicle detonated in Karte Naw neighborhood, Kabul city, Kabul province, Afghanistan. At least two people were injured in the blast. No group claimed responsibility for the attack.",Military,Unknown,Explosives/Bombs/Dynamite,0,2
149653,201506300016,2015,6,30,Afghanistan,South Asia,Kabul,Kabul,34.530007,69.12347,"06/30/2015: An explosive device detonated near an Afghan Ministry of Transport and Civil Aviation directorate building in Karte Mahmorin neighborhood, Kabul city, Kabul province, Afghanistan. There were no reported casualties in the blast. No group claimed responsibility for the attack.",Government (General),Unknown,Explosives/Bombs/Dynamite,0,0
149654,201506300017,2015,6,30,Afghanistan,South Asia,Sari Pul,Sayyad district,36.029713,65.845813,"06/30/2015: An explosive device detonated near the vehicle of Tofan in Sayyad district, Saripul province, Afghanistan. Tofan, an Afghan Police commander, was killed and at least 11 others were injured in the blast. No group claimed responsibility for the attack.",Police,Unknown,Explosives/Bombs/Dynamite,1,11
149662,201506300046,2015,6,30,Afghanistan,South Asia,Nangarhar,Marko,34.249953999999995,70.80825300000001,"06/30/2015: Assailants opened fire on Mufti Moin Shah Haqqani at a bazaar in Marko, Nangarhar province, Afghanistan. Haqqani, the former deputy head of the Nangarhar Provincial Council, was killed in the assault. No group claimed responsibility; however, officials attributed the attack to the Taliban.",Government (General),Taliban,Firearms,1,0
149666,201506300053,2015,6,30,Afghanistan,South Asia,Logar,Baraki Barak district,33.968747,68.95020500000001,"06/30/2015: Assailants fired a mortar that struck a civilian residence in Baraki Barak district, Logar province, Afghanistan. At least one person was killed and six others were injured in the blast. No group claimed responsibility; however, officials attributed the attack to the Taliban.",Private Citizens & Property,Taliban,Explosives/Bombs/Dynamite,1,6
149682,201506300085,2015,6,30,Afghanistan,South Asia,Herat,Karukh district,34.490826,62.602922,"06/30/2015: Assailants attacked and killed two civilians, including a teacher, that were accused of spying for the government in Karukh district, Herat province, Afghanistan. No group claimed responsibility; however, sources attributed the incident to the Taliban.",Educational Institution,Taliban,Unknown,2,0
149684,201506300088,2015,6,30,Afghanistan,South Asia,Kandahar,Unknown,31.628871000000004,65.737175,"06/30/2015: Assailants attacked an Afghan Local Police (ALP) checkpost in Kandahar province, Afghanistan. At least two officers were killed and another was wounded in the incident. The Taliban claimed responsibility for the attack.",Police,Taliban,Unknown,2,1
149710,201507010031,2015,7,1,Afghanistan,South Asia,Wardak,Jaghtu district,33.83597,68.35531999999999,"07/01/2015: An assailant was killed when attempting to plant an explosive device in Jaghtu district, Maidan Wardak province, Afghanistan. No group claimed responsibility for the incident; however, sources attributed the attempted attack to the Taliban.",Unknown,Taliban,Explosives/Bombs/Dynamite,1,0
149711,201507010032,2015,7,1,Afghanistan,South Asia,Badghis,Qadis district,34.863638,63.644580000000005,"07/01/2015: Assailants attacked a police checkpoint near civilian homes in Gulchan area, Qadis district, Badghis province, Afghanistan. One police officer was killed and three civilians were injured in the attack. No group claimed responsibility for the incident.",Police,Unknown,Firearms,1,3
149712,201507010033,2015,7,1,Afghanistan,South Asia,Faryab,Gordzad,36.186928,64.873367,"07/01/2015: Assailants opened fire on a civilian vehicle in Gorzada area, Faryab province, Afghanistan. Two civilians were injured in the attack. No group claimed responsibility; however, sources attributed the incident to the Taliban.",Private Citizens & Property,Taliban,Firearms,0,2
149727,201507010127,2015,7,1,Afghanistan,South Asia,Ghazni,Mohkam,33.319423,68.45004200000001,"07/01/2015: Assailants shot and killed a tribal elder in Mohkam area, Andar district, Ghazni province, Afghanistan. The victim was also the father of an anti-Taliban militia member. No group claimed responsibility for the incident.",Private Citizens & Property,Unknown,Firearms,1,0
