,id,year,month,day,country,region,state,city,latitude,longitude,summary,target,tgroup,weapon,fatalities,injuries
86299,200804150015,2008,4,15,New Zealand,Australasia & Oceania,Wellington,Wellington,-41.28646,174.776236,"04/15/2008: On Tuesday morning, on Conventry Road, in Hastings, New Zealand, six pipe bombs were found and dismantled by the Army's bomb disposal units at Cash for Scrap. No casualties or damage resulted from the attempted attack. No motive was reported and no group claimed responsibility.",Business,Unknown,Explosives/Bombs/Dynamite,0,0
87443,200806240014,2008,6,24,New Zealand,Australasia & Oceania,Wellington,Wellington,-41.28646,174.776236,"6/24/2008: On Tuesday, a letter containing 1080 poison was sent to the Ministry of Agriculture and Forestry building in Wellington, Wellington State, New Zealand. The 1080 poison is used as a pesticide. No casualties were reported and no claim of responsibility was made for the incident.",Government (General),Unknown,Chemical,0,0
87444,200806240016,2008,6,24,New Zealand,Australasia & Oceania,Wellington,Wellington,-41.28646,174.776236,"6/24/2008: On Tuesday, a letter containing 1080 poison was sent to the Parliament building in Wellington, Wellington State, New Zealand. The 1080 poison is used as a pesticide. No casualties were reported and no claim of responsibility was made for the incident.",Government (General),Unknown,Chemical,0,0
87445,200806240017,2008,6,24,New Zealand,Australasia & Oceania,Wellington,Wellington,-41.28646,174.776236,"6/24/2008: On Tuesday, a letter containing 1080 poison was sent to the Government Reserve Bank in Wellington, Wellington State, New Zealand. The 1080 poison is used as a pesticide. No casualties were reported and no claim of responsibility was made for the incident.",Government (General),Unknown,Chemical,0,0
88316,200808130025,2008,8,13,New Zealand,Australasia & Oceania,Wellington,Wellington,-41.28646,174.776236,"08/13/2008: On Wednesday, a white powder was found in an envelope in the party offices of the Prime Minister Helen Clark in Wellington, New Zealand. The area was evacuated and decontaminated though the nature of the powder has not been confirmed. Douglas Hancock pleaded guilty to sending the letter.",Government (General),Unknown,Chemical,0,0
