,id,year,month,day,country,region,state,city,latitude,longitude,summary,target,tgroup,weapon,fatalities,injuries
118099,201306200012,2013,6,20,Thailand,Southeast Asia,Pattani,Mayo district,6.717207000000001,101.414327,"06/20/2013: An explosive device hidden in a gas canister detonated in Mayo district, Pattani province, Thailand. The blast targeted a group of soldiers protecting teachers. Five soldiers were wounded in the blast. No group claimed responsibility for the incident.",Military,Unknown,Explosives/Bombs/Dynamite,0,5
118100,201306200013,2013,6,20,Thailand,Southeast Asia,Yala,Raman district,6.490158999999999,101.387535,"06/20/2013: Gunmen shot and killed a village chief in Raman district, Yala province, Thailand. No group claimed responsibility for this attack.",Government (General),Unknown,Firearms,1,0
118157,201306220028,2013,6,22,Thailand,Southeast Asia,Pattani,Nong Chik district,6.811989,101.188251,"06/22/2013: A remote-controlled explosive device detonated in Nong Chik district, Pattani province, Thailand. The blast targeted a pickup truck carrying soldiers. Two soldiers were killed and four others were injured in the blast. No group claimed responsibility for the incident.",Military,Unknown,Explosives/Bombs/Dynamite,2,4
118190,201306230036,2013,6,23,Thailand,Southeast Asia,Yala,Sateng,6.542599,101.283202,"06/23/2013: An explosive device detonated in Sateng, Yala province, Thailand. The device had been panted near a power pole and it detonated as a Ranger vehicle passed by. Three Rangers and three civilians were injured in the blast. No group claimed responsibility for the incident.",Military,Unknown,Explosives/Bombs/Dynamite,0,6
118289,201306260030,2013,6,26,Thailand,Southeast Asia,Pattani,Thung Yang Daeng district,6.621249000000001,101.4308,"06/26/2013: A remote-controlled explosive device detonated near Mobile Development Unit soldiers in Thung Yang Daeng district, Pattani province, Thailand. One soldier was killed, while two soldiers and three civilians were injured in the blast. No group claimed responsibility for the incident.",Military,Unknown,Explosives/Bombs/Dynamite,1,5
118291,201306260032,2013,6,26,Thailand,Southeast Asia,Yala,Pron,6.554196000000001,101.23161800000001,"06/26/2013: A roadside bomb targeted a group of soldiers providing protection for teachers in Pron, Yala province, Thailand. Two soldiers were injured in the blast. No group claimed responsibility for the incident; however, police attributed the attack to separatists.",Military,Separatists,Explosives/Bombs/Dynamite,0,2
118322,201306270034,2013,6,27,Thailand,Southeast Asia,Pattani,Momawi,6.6694759999999995,101.307539,"06/27/2013: An explosive device detonated near a Rangers patrol vehicle in Momawi, Pattani province, Thailand. No injuries were reported. No group claimed responsibility; however, police officials speculated that separatists were involved.",Military,Separatists,Explosives/Bombs/Dynamite,0,0
118341,201306280013,2013,6,28,Thailand,Southeast Asia,Narathiwat,Phadungmat,6.128536,101.738648,"06/28/2013: Two assailants shot and killed the Ban Luboh village chief in Phadungmat, Narathiwat province, Thailand. No group claimed responsibility; however, police attributed the attack to separatists.",Government (General),Separatists,Firearms,1,0
118345,201306280019,2013,6,28,Thailand,Southeast Asia,Songkhla,Na Thawi,6.703139,100.765028,"06/28/2013: An explosives-laden motorcycle detonated at a tea shop in Na Thawi district, Songkhla province, Thailand. One person was killed and six people were injured in the blast. No group claimed responsibility for the incident.",Business,Unknown,Explosives/Bombs/Dynamite,1,6
118359,201306290002,2013,6,29,Thailand,Southeast Asia,Yala,Krong Pinang,6.399578,101.229,"06/29/2013: A roadside bomb detonated under an amy truck in Krong Pinang district, Yala province, Thailand. Eight soldiers were killed and four others were wounded. No group claimed responsibility for the incident; however, authorities speculated that separatists were involved.",Military,Separatists,Explosives/Bombs/Dynamite,8,4
118373,201306290020,2013,6,29,Thailand,Southeast Asia,Narathiwat,Rueso,6.392545,101.520742,"06/29/2013: Gunmen opened fire on civilians in Rueso district, Narathiwat province, Thailand. Two civilians were wounded in the attack. No group claimed responsibility for the incident; however, authorities attributed the attack to separatists.",Private Citizens & Property,Separatists,Firearms,0,2
118408,201306300033,2013,6,30,Thailand,Southeast Asia,Narathiwat,Cho-airong district,6.223675,101.81218,"06/30/2013: Assailants burned six closed circuit television (CCTV) cameras in Cho Airong district, Narathiwat province, Thailand. No injuries were reported. This was one of five coordinated attacks on CCTV cameras in Narathiwat province on this day. No group claimed responsibility for these attacks.",Government (General),Unknown,Incendiary,0,0
118409,201306300035,2013,6,30,Thailand,Southeast Asia,Narathiwat,Pinang district,6.390629,101.22971,"06/30/2013: Assailants burned six closed circuit television (CCTV) cameras in Pinang district, Narathiwat province, Thailand. No injuries were reported. This was one of five coordinated attacks on CCTV cameras in Narathiwat province on this day. No group claimed responsibility for these attacks.",Government (General),Unknown,Incendiary,0,0
118410,201306300036,2013,6,30,Thailand,Southeast Asia,Narathiwat,Muang Narathiwat district,6.5414900000000005,101.25680899999999,"06/30/2013: Assailants burned five closed circuit television (CCTV) cameras in Mueang district, Narathiwat province, Thailand. No injuries were reported. This was one of five coordinated attacks on CCTV cameras in Narathiwat province on this day. No group claimed responsibility for these attacks.",Government (General),Unknown,Incendiary,0,0
118411,201306300037,2013,6,30,Thailand,Southeast Asia,Narathiwat,Chanae,6.072563,101.661163,"06/30/2013: Assailants burned three closed circuit television (CCTV) cameras in Chanae district, Narathiwat province, Thailand. No injuries were reported. This was one of five coordinated attacks on CCTV cameras in Narathiwat province on this day. No group claimed responsibility for these attacks.",Government (General),Unknown,Incendiary,0,0
118412,201306300038,2013,6,30,Thailand,Southeast Asia,Narathiwat,Si Sakhon,6.175783999999999,101.502075,"06/30/2013: Assailants burned a closed circuit television (CCTV) camera in Si Sakhon district, Narathiwat province, Thailand. No injuries were reported. This was one of five coordinated attacks on CCTV cameras in Narathiwat province on this day. No group claimed responsibility for these attacks.",Government (General),Unknown,Incendiary,0,0
118414,201306300040,2013,6,30,Thailand,Southeast Asia,Pattani,Nong Chik district,6.810194,101.179218,"06/30/2013: Gunmen opened fire on Sama-ae Ali in Nong Chik district, Pattani province, Thailand. Ali, a former paramilitary ranger, was killed in the attack. No group claimed responsibility for the incident.",Military,Unknown,Firearms,1,0
118493,201307020053,2013,7,2,Thailand,Southeast Asia,Narathiwat,Ban Sala,6.229982,101.80475600000001,"07/02/2013: A roadside bomb detonated in Ban Sala area, Cho-airong district, Narathiwat province, Thailand. Two people, including one defense volunteer, were injured in the blast. No group claimed responsibility for the incident; however, police attributed the attack to separatists.",Police,Separatists,Explosives/Bombs/Dynamite,0,2
118521,201307030032,2013,7,3,Thailand,Southeast Asia,Yala,Bannang Sata district,6.239538,101.284225,"07/03/2013: An explosive device was discovered near the entrance of the Nerancharawat Temple in Bannang Sata district, Yala province, Thailand. As police officers were attempting to defuse the device, it detonated injuring one police officer. No group claimed responsibility for the incident.",Religious Figures/Institutions,Unknown,Explosives/Bombs/Dynamite,0,1
118522,201307030033,2013,7,3,Thailand,Southeast Asia,Yala,Bannang Sata district,6.239538,101.284225,"07/03/2013: An explosive device was discovered and defused in front of the Krung Thai Bank in Bannang Sata district, Yala province, Thailand. No group claimed responsibility for the incident.",Business,Unknown,Explosives/Bombs/Dynamite,0,0
118527,201307030046,2013,7,3,Thailand,Southeast Asia,Yala,Raman district,6.491822,101.3885,"07/03/2013: Gunmen opened fire on Pakdee Nirohing and his colleague in Raman district, Yala province, Thailand. Nirohing, the chief for the Tambon Noen Ngam Administrative Organization, and his colleague were injured in the attack. No group claimed responsibility for the incident.",Government (General),Unknown,Firearms,0,2
118548,201307040042,2013,7,4,Thailand,Southeast Asia,Narathiwat,Chanae district,6.100274,101.660507,"07/04/2013: A roadside bomb detonated near a paramilitary patrol in Chanae district, Narathiwat province, Thailand. Three volunteer soldiers were injured in the blast. No group claimed responsibility for the incident; however, authorities attributed the attack to separatists.",Military,Separatists,Explosives/Bombs/Dynamite,0,3
118560,201307040064,2013,7,4,Thailand,Southeast Asia,Yala,Ban Yo,6.491822,101.3885,"07/04/2013: Assailants opened fire on the tambon administration organization (TAO) members in Ban Yo village, Raman district, Yala province, Thailand. One member was killed and the chairperson was injured in the attack. No group claimed responsibility for the incident.",Government (General),Unknown,Firearms,1,1
118591,201307050032,2013,7,5,Thailand,Southeast Asia,Narathiwat,Kampong Buke,6.012557,101.83215600000001,"07/05/2013: Assailants opened fire on a defense volunteer, Asi Maseng, as he rode through Kampong Buke village, Narathiwat province, Thailand. Maseng was unhurt in the attack. This was one of two related incidents. Following the shooting, an explosive device detonated near a group of defense volunteers who were responding to this first attack. No group claimed responsibility for this incident.",Police,Unknown,Firearms,0,0
118592,201307050033,2013,7,5,Thailand,Southeast Asia,Narathiwat,Kampong Buke,6.012557,101.83215600000001,"07/05/2013: An explosive device targeting a group of defense volunteers detonated in Kampong Buke village, Narathiwat province, Thailand. Five defense volunteers were injured by the blast. This was the second of two incidents, which occurred as the group was responding to an earlier shooting. No group claimed responsibility for this incident.",Police,Unknown,Explosives/Bombs/Dynamite,0,5
118656,201307070031,2013,7,7,Thailand,Southeast Asia,Pattani,Khlong Chang,6.74397,101.15607299999999,"07/07/2013: Assailants shot and killed a village defense volunteer in Khlong Chang village, Khok Pho district, Pattani province, Thailand. No group claimed responsibility for the incident.",Police,Unknown,Firearms,1,0
118664,201307080001,2013,7,8,Thailand,Southeast Asia,Pattani,Kg Rawa,6.761272,101.447997,"07/08/2013: A roadside bomb detonated as soldiers were en route to a local school in Kg Rawa town, Mayo district, Pattani province, Thailand. Eight soldiers were wounded by the blast. No group claimed responsibility for the incident.",Military,Unknown,Explosives/Bombs/Dynamite,0,8
118801,201307110049,2013,7,11,Thailand,Southeast Asia,Yala,Balo,6.446829,101.45220400000001,"07/11/2013: A roadside bomb detonated as a military patrol was passing by in Balo sub-district, Raman district, Yala province, Thailand. Eight soldiers were injured by the blast. No group claimed responsibility for the incident.",Military,Unknown,Explosives/Bombs/Dynamite,0,8
118980,201307160044,2013,7,16,Thailand,Southeast Asia,Yala,Bannang Sata district,6.244998000000001,101.284912,"07/16/2013: Gunmen shot and killed Mayahari Ali, a rubber tapper, in Bannang Sata district, Yala province, Thailand. No group claimed responsibility for the incident.",Private Citizens & Property,Unknown,Firearms,1,0
119011,201307170038,2013,7,17,Thailand,Southeast Asia,Yala,Khuean Bang Lang,6.1571169999999995,101.32594399999999,"07/17/2013: An explosive device detonated near a Ranger patrol providing security to teachers in Khuean Bang Lang sub-district, Yala province, Thailand. At least one soldier was injured in the blast. No group claimed responsibility; however, authorities attributed the incident to separatists.",Military,Separatists,Explosives/Bombs/Dynamite,0,1
119012,201307170039,2013,7,17,Thailand,Southeast Asia,Narathiwat,Cho-airong,6.211551,101.820545,"07/17/2013: Assailants detonated a roadside bomb and the opened fire on a military convoy in Cho-airong district, Narathiwat province, Thailand. Two soldiers were wounded in the attack. No group claimed responsibility; however, authorities attributed the incident to the Runda Kumpulan Kecil (RKK).",Military,Runda Kumpulan Kecil (RKK),Explosives/Bombs/Dynamite,0,2
119040,201307180021,2013,7,18,Thailand,Southeast Asia,Pattani,Khok Pho district,6.735771000000001,101.05420500000001,"07/18/2013: Assailants opened fire on an under-construction mosque in Khok Pho district, Pattani province, Thailand. There were no reported casualties resulting from the attack. No group claimed responsibility for the incident.",Religious Figures/Institutions,Unknown,Firearms,0,0
119116,201307200043,2013,7,20,Thailand,Southeast Asia,Pattani,Dusong Payae,6.828057,101.3885,"07/20/2013: Assailants opened fire on Ma-air Jehma and Ameenoh Kama in Dusong Payae village, Pattani province, Thailand. Jehma, a former village head and rubber tapper, and Kama, also a rubber tapper, were killed in the attack. No group claimed responsibility for the incident.",Private Citizens & Property,Unknown,Firearms,2,0
119248,201307230033,2013,7,23,Thailand,Southeast Asia,Pattani,Wat,6.730036999999999,101.303403,"07/23/2013: Assailants opened fire on Saree Maming in Wat village, Pattani province, Thailand. Maming, the Rawaeng village chief, was injured in the attack. No group claimed responsibility for the incident.",Government (General),Unknown,Firearms,0,1
119253,201307230040,2013,7,23,Thailand,Southeast Asia,Pattani,Yaring,6.828057,101.3885,"07/23/2013: Gunmen opened fire on Madaree Lameng in Yaring district, Pattani province, Thailand. Lameng, the chief of Nong Raet subdistrict, was killed in the attack. No group claimed responsibility for the incident.",Government (General),Unknown,Firearms,1,0
119301,201307240048,2013,7,24,Thailand,Southeast Asia,Narathiwat,Chanae,6.128437,101.697323,"07/24/2013: An explosive device detonated near a police vehicle in Chanae district, Narathiwat province, Thailand. At least two teachers were killed and three others, including two officers and one teacher, were injured in the blast. The Barisan Revolusi Nasional (BRN) claimed responsibility for the attack.",Police,Barisan Revolusi Nasional (BRN),Explosives/Bombs/Dynamite,2,3
119313,201307240067,2013,7,24,Thailand,Southeast Asia,Unknown,Unknown,,,07/24/2013: A roadside bomb detonated in an unknown location in Thailand. At least three teachers were killed in the explosion. No group claimed responsibility for the incident.,Educational Institution,Unknown,Explosives/Bombs/Dynamite,3,0
119314,201307240068,2013,7,24,Thailand,Southeast Asia,Unknown,Unknown,,,07/24/2013: Gunmen opened fire on a tea shop in an unknown location in Thailand. At least two people were killed in the shooting. No group claimed responsibility for the incident.,Business,Unknown,Firearms,2,0
119383,201307260042,2013,7,26,Thailand,Southeast Asia,Yala,Betong district,5.779625,101.048271,"07/26/2013: Gunmen shot and killed Ahamah Dorloh, an Islamic school teacher, in Betong district, Yala province, Thailand. No group claimed responsibility for the incident.",Educational Institution,Unknown,Firearms,1,0
119561,201307310031,2013,7,31,Thailand,Southeast Asia,Yala,Lam Mai,6.574714999999999,101.201382,"07/31/2013: A roadside bomb detonated near two police officers who were providing security for teachers along a road near Thung Ka village in Lam Mai sub-district, Muang district, Yala province, Thailand. Two police officers were injured in the blast. No group claimed responsibility; however, sources attributed the attack to separatists.",Police,Separatists,Explosives/Bombs/Dynamite,0,2
119570,201307310046,2013,7,31,Thailand,Southeast Asia,Bangkok,Bangkok,13.75,100.466667,"07/31/2013: A grenade was thrown at the residence of Vice Admiral Pajun Tamprateep in Moobaan Ruenrom village, Taling Chan district, Bangkok city, Bangkok province, Thailand. The grenade failed to detonate. No group claimed responsibility for the incident.",Military,Unknown,Explosives/Bombs/Dynamite,0,0
119571,201307310051,2013,7,31,Thailand,Southeast Asia,Pattani,Unknown,6.869484,101.250483,"07/31/2013: An explosive device planted along a road detonated in Pattani province, Thailand. The explosion targeted soldiers escorting teachers, injuring two. No group claimed responsibility for the incident.",Military,Unknown,Explosives/Bombs/Dynamite,0,2
119573,201307310053,2013,7,31,Thailand,Southeast Asia,Yala,Yaha,6.497905,101.116445,"07/31/2013: An explosive device planted along a road detonated in Yaha district, Yala province, Thailand. One military Ranger was killed in the explosion. No group claimed responsibility; however, authorities attributed the incident to separatists.",Military,Separatists,Explosives/Bombs/Dynamite,1,0
119574,201307310054,2013,7,31,Thailand,Southeast Asia,Yala,Bannang Sata district,6.244998000000001,101.284912,"07/31/2013: An explosive device detonated outside of the ban Taopoon school in Bannang Sata district, Yala province, Thailand. A defense volunteer guarding the school was injured in the blast. No group claimed responsibility for the incident; however, authorities attributed the attack to a group led by Sakariya Hayisamoh.",Educational Institution,Unknown,Explosives/Bombs/Dynamite,0,1
119575,201307310055,2013,7,31,Thailand,Southeast Asia,Yala,Bannang Sata district,6.244998000000001,101.284912,"07/31/2013: Assailants opened fire on a village guard who was on his way to a rubber plantation in Bannang Sata district, Yala province, Thailand. The guard was injured in the attack. No group claimed responsibility for the incident.",Business,Unknown,Firearms,0,1
119627,201308020006,2013,8,2,Thailand,Southeast Asia,Yala,Ba-ngoi Sinae,6.473609,101.34607700000001,"08/02/2013: An explosive device detonated near a military foot patrol, which was providing security to teachers in Ba-ngoi Sinae village, Yala province, Thailand. One soldier was killed in the attack. No group claimed responsibility for the incident.",Military,Unknown,Explosives/Bombs/Dynamite,1,0
119628,201308020007,2013,8,2,Thailand,Southeast Asia,Narathiwat,Jekae,6.254148000000001,101.729605,"08/02/2013: A roadside bomb detonated as a military foot patrol, providing security to teachers, was passing by in Jekae subdistrict, Rangae district, Narathiwat province, Thailand. One soldier was injured in the blast. No group claimed responsibility for the incident.",Military,Unknown,Explosives/Bombs/Dynamite,0,1
119644,201308020027,2013,8,2,Thailand,Southeast Asia,Yala,Muang Yala district,6.5384199999999995,101.27804499999999,"08/02/2013: Assailants set fire to the Teck Bee Hang Corporation factory in Mueang Yala district, Yala province, Thailand. There were no reported casualties and no information regarding damages. This was one of at least 12 coordinated arson attacks, all occurring within an hour in the early morning, in Thailand. No group claimed responsibility for the incident.",Business,Unknown,Incendiary,0,0
119645,201308020028,2013,8,2,Thailand,Southeast Asia,Yala,Muang Yala district,6.5384199999999995,101.27804499999999,"08/02/2013: Assailants set fire to the P Parawood Corporation factory in Mueang Yala district, Yala province, Thailand. There were no reported casualties and no information regarding damages. This was one of at least 12 coordinated arson attacks, all occurring within an hour in the early morning, in Thailand. No group claimed responsibility for the incident.",Business,Unknown,Incendiary,0,0
119646,201308020029,2013,8,2,Thailand,Southeast Asia,Yala,Muang Yala district,6.5384199999999995,101.27804499999999,"08/02/2013: Assailants set fire to the Yala Tharnthong Corporation factory in Mueang Yala district, Yala province, Thailand. There were no reported casualties and no information regarding damages. This was one of at least 12 coordinated arson attacks, all occurring within an hour in the early morning, in Thailand. No group claimed responsibility for the incident.",Business,Unknown,Incendiary,0,0
119647,201308020030,2013,8,2,Thailand,Southeast Asia,Yala,Muang Yala district,6.5384199999999995,101.27804499999999,"08/02/2013: Assailants set fire to the Union Plastic Limited factory in Mueang Yala district, Yala province, Thailand. There were no reported casualties and no information regarding damages. This was one of at least 12 coordinated arson attacks, all occurring within an hour in the early morning, in Thailand. No group claimed responsibility for the incident.",Business,Unknown,Incendiary,0,0
119648,201308020031,2013,8,2,Thailand,Southeast Asia,Yala,Muang Yala district,6.552064,101.262939,"08/02/2013: Assailants set fire to the Yang Paktai factory in Mueang Yala district, Yala province, Thailand. There were no reported casualties; however, the factory was damaged. This was one of at least 12 coordinated arson attacks, all occurring within an hour in the early morning, in Thailand. No group claimed responsibility for the incident.",Business,Unknown,Incendiary,0,0
119649,201308020032,2013,8,2,Thailand,Southeast Asia,Yala,Unknown,6.5411470000000005,101.280395,"08/02/2013: Assailants set fire to a mobile cell tower in Yala province, Thailand. There were no reported casualties and no information regarding damages. This was one of at least 12 coordinated arson attacks, all occurring within an hour in the early morning, in Thailand. No group claimed responsibility for the incident.",Telecommunication,Unknown,Incendiary,0,0
119650,201308020033,2013,8,2,Thailand,Southeast Asia,Pattani,Nong Chik district,6.812239,101.18265500000001,"08/02/2013: Assailants set fire to the Phithan Panich motorcycle and bicycle shop in Nong Chik district, Pattani province, Thailand. There were no reported casualties; however, 64 motorcycles and bicycles were damaged in the fire. This was one of at least 12 coordinated arson attacks, all occurring within an hour in the early morning, in Thailand. No group claimed responsibility for the incident.",Business,Unknown,Incendiary,0,0
119651,201308020034,2013,8,2,Thailand,Southeast Asia,Pattani,Khok Pho district,6.685749,101.138366,"08/02/2013: Assailants set fire to a minimart in Khok Pho district, Pattani province, Thailand. There were no reported casualties. This was one of at least 12 coordinated arson attacks, all occurring within an hour in the early morning, in Thailand. No group claimed responsibility for the incident.",Business,Unknown,Incendiary,0,0
119652,201308020035,2013,8,2,Thailand,Southeast Asia,Pattani,Nong Chik,6.822807000000001,101.18396800000001,"08/02/2013: Assailants set fire to a company in Khok Pho district, Pattani province, Thailand. No casualties were reported. This was one of at least 12 coordinated arson attacks, all occurring within an hour in the early morning, in Thailand. No group claimed responsibility for the incident.",Business,Unknown,Incendiary,0,0
119653,201308020036,2013,8,2,Thailand,Southeast Asia,Songkhla,Tepa,6.840533,100.940609,"08/02/2013: Assailants set fire to a furniture shop in Tepa district, Songkhla province, Thailand. There were no reported casualties and no information regarding damages. This was one of two attacks on furniture shops in Tepa district and one of at least 12 coordinated arson attacks, all occurring within an hour in the early morning, in Thailand. No group claimed responsibility for the incident.",Business,Unknown,Incendiary,0,0
119654,201308020037,2013,8,2,Thailand,Southeast Asia,Songkhla,Tepa,6.840533,100.940609,"08/02/2013: Assailants set fire to a furniture shop in Tepa district, Songkhla province, Thailand. There were no reported casualties and no information regarding damages. This was one of two attacks on furniture shops in Tepa district and one of at least 12 coordinated arson attacks, all occurring within an hour in the early morning, in Thailand. No group claimed responsibility for the incident.",Business,Unknown,Incendiary,0,0
119655,201308020038,2013,8,2,Thailand,Southeast Asia,Songkhla,Saba Yoi,6.521366,100.847397,"08/02/2013: Assailants set fire to a shop in Saba district, Songkhla province, Thailand. There were no reported casualties and no information regarding damages. This was one of at least 12 coordinated arson attacks, all occurring within an hour in the early morning, in Thailand. No group claimed responsibility for the incident.",Business,Unknown,Incendiary,0,0
119656,201308020039,2013,8,2,Thailand,Southeast Asia,Pattani,Saiburi district,6.6501149999999996,101.553127,"08/02/2013: An explosive device detonated near a Ranger patrol in Kadunong subdistrict, Saiburi district, Pattani province, Thailand. One soldier was wounded in the attack. No group claimed responsibility for the incident.",Military,Unknown,Explosives/Bombs/Dynamite,0,1
119657,201308020042,2013,8,2,Thailand,Southeast Asia,Narathiwat,Chuap,6.236175,101.805296,"08/02/2013: Assailants shot and killed Ranger Jira Chanmeechote in Chuap subdistrict, Narathiwat province, Thailand. No group claimed responsibility for the incident.",Military,Unknown,Firearms,1,0
