,id,year,month,day,country,region,state,city,latitude,longitude,summary,target,tgroup,weapon,fatalities,injuries
113587,201301160038,2013,1,16,Bahrain,Middle East & North Africa,Central,Sitra,26.162526,50.6119,"01/16/2013: Assailants set fire to five vehicles owned by a family in Sitra, Central, Bahrain. There were no reported injuries resulting from the fire, although the vehicles were destroyed. The family said they were targeted because two members work for the police. No group claimed responsibility for the incident.",Private Citizens & Property,Unknown,Incendiary,0,0
113938,201301300008,2013,1,30,Bahrain,Middle East & North Africa,Capital,Jidhafs,26.219210999999998,50.532633000000004,"01/30/2013: An explosive device detonated on Budaiya Highway in Jidhafs city, Capital, Bahrain. A police vehicle was struck and three police officers were wounded. There was no claim of responsibility for this attack.",Police,Unknown,Explosives/Bombs/Dynamite,0,3
114253,201302120027,2013,2,12,Bahrain,Middle East & North Africa,Central,Isa Town,26.173610999999998,50.547778,"02/12/2013: A remote-controlled explosive device detonated at a market in Isa Town, Central governorate, Bahrain. No one was injured in the attack. No group claimed responsibility for the incident.",Private Citizens & Property,Unknown,Explosives/Bombs/Dynamite,0,0
114296,201302140025,2013,2,14,Bahrain,Middle East & North Africa,Unknown,Unknown,,,02/14/2013: A two kilogram pressure cooker bomb was found and defused by security forces near a mosque on the King Fahad Causeway in Bahrain. No group claimed responsibility for the incident.,Religious Figures/Institutions,Unknown,Explosives/Bombs/Dynamite,0,0
114305,201302140045,2013,2,14,Bahrain,Middle East & North Africa,Capital,Manama,26.216666999999998,50.583333,"02/14/2013: A car was set on fire on Roundabout 18 in Hamad Town area of Manama city, Capital governorate, Bahrain. There were no reports of casualties in the attack. No group claimed responsibility for the incident; however, authorities arrested five individuals in connection with the arson attack that they claim are members of the February 14th Movement.",Private Citizens & Property,Unknown,Incendiary,0,0
114410,201302180014,2013,2,18,Bahrain,Middle East & North Africa,Central,Sitra,26.162717999999998,50.611959999999996,"02/18/2013: A building housing two car dealerships and a car battery shop was set on fire in Sitra, Central governorate, Bahrain. There were no reported casualties resulting from the attack; however, approximately 15 cars were destroyed in the fire, which was believed to have been set deliberately. No group claimed responsibility for the incident.",Business,Unknown,Incendiary,0,0
114418,201302180030,2013,2,18,Bahrain,Middle East & North Africa,Central,Sanad,26.150199,50.582401000000004,"02/18/2013: An explosive device detonated inside an automated teller machine (ATM) in Sanad, Central, Bahrain. There were no reported casualties, although the blast resulted in material damage. Sources attrtibute the attack to the February 14th Movement.",Business,February 14th Movement,Explosives/Bombs/Dynamite,0,0
114840,201303070007,2013,3,7,Bahrain,Middle East & North Africa,Central,Ma'ameer,26.134677,50.613255,"03/07/2013: Assailants set fire to the Ma'ameer Primary School for Boys in Ma'ameer village, Central governorate, Bahrain. Classroom furniture, air conditioning equipment, and window panes were damaged in the attack; however, no one was hurt. No group claimed responsibility for the incident.",Educational Institution,Unknown,Incendiary,0,0
114841,201303070008,2013,3,7,Bahrain,Middle East & North Africa,Northern,Duraz,26.216666999999998,50.466667,"03/07/2013: Assailants threw incendiary devices at the Duraz Intermediate School for Girls in Duraz village, Northern governorate, Bahrain. No one was hurt in the attack and it is unknown if the school suffered any damage. No group claimed responsibility for the incident.",Educational Institution,Unknown,Incendiary,0,0
114842,201303070009,2013,3,7,Bahrain,Middle East & North Africa,Central,Nuwaidrat,26.133333,50.6,"03/07/2013: Assailants set fire to the main gate of the Nuwaidrat Primary School for Girls in Nuwaidrat village, Central governorate, Bahrain. No one was hurt in the attack; however, the main gate to the school suffered fire damage. No group claimed responsibility for the incident.",Educational Institution,Unknown,Incendiary,0,0
114892,201303090007,2013,3,9,Bahrain,Middle East & North Africa,Capital,Sanabis,26.226559,50.54591,"03/09/2013: An explosion occurred near the Ahli United Bank in Sanabis village, Capital governorate, Bahrain. No one was injured in the blast. No group claimed responsibility for the attack.",Business,Unknown,Explosives/Bombs/Dynamite,0,0
114988,201303130012,2013,3,13,Bahrain,Middle East & North Africa,Central,Nuwaidrat,26.133333,50.6,"03/13/2013: An explosive device hidden in a cardboard box targeted a police patrol in Nuwaidrat, Central governorate, Bahrain. No one was injured in the blast. No group claimed responsibility for the incident.",Police,Unknown,Explosives/Bombs/Dynamite,0,0
114989,201303130013,2013,3,13,Bahrain,Middle East & North Africa,Northern,Hamad,26.116667,50.5,"03/13/2013: An explosive device targeted a police patrol in Hamad Town, Northern governorate, Bahrain. No one was injured in the blast. No group claimed responsibility for the incident.",Police,Unknown,Explosives/Bombs/Dynamite,0,0
115065,201303170008,2013,3,17,Bahrain,Middle East & North Africa,Muharraq,Dair,26.286528000000004,50.623622999999995,"03/17/2013: A home-made explosive device placed near a school detonated when a worker from Bangladesh was picking up trash in Al-Dair, Muharraq governorate, Bahrain. One person was injured in the attack. Two perpetrators were arrested in the attack that claimed allegiance to the February 14th Movement.",Educational Institution,February 14th Movement,Explosives/Bombs/Dynamite,0,1
115386,201303280045,2013,3,28,Bahrain,Middle East & North Africa,Southern,Dar Kulaib,26.064339,50.50405,"03/28/2013: Assailants set fire to a car on Al Zallaq Road, near Dar Kulaib city, Southern governorate, Bahrain. There were no reports of casualties in the attack. No group claimed responsibility for the incident; however, authorities arrested four individuals in connection with the arson attack that they claim are members of the February 14th Movement. The incident appears to be part of a larger pattern of attacks committed by the organization that targeted vehicles and car dealerships throughout Bahrain.",Private Citizens & Property,Unknown,Incendiary,0,0
115515,201304010058,2013,4,1,Bahrain,Middle East & North Africa,Southern,Zallaq,26.0316,50.5129,"04/01/2013: Assailants set fire to a vehicle near the Bahrain International Circuit (BIC) in Bahrain. There were no reports of casualties in the attack. No group claimed responsibility for the incident; however, authorities arrested four individuals in connection with the arson.",Private Citizens & Property,Unknown,Incendiary,0,0
115668,201304080003,2013,4,8,Bahrain,Middle East & North Africa,Capital,Manama,26.216666999999998,50.583333,"04/08/2013: Assailants threw incendiary devices at the Dar al-Hukumah compound housing the foreign ministry in Manama city, Capital governorate, Bahrain. Security forces were able to repel the attackers without incurring damages. No casualties were reported and no group claimed responsibility for the incident.",Government (General),Unknown,Incendiary,0,0
115814,201304120028,2013,4,12,Bahrain,Middle East & North Africa,Capital,Juffair,26.211111,50.601110999999996,"04/12/2013: An explosive device planted in a car detonated in Juffair area of Al-Manamah city, Capital governorate, Bahrain. The car was damaged in the blast; however, no casualties were reported. No group claimed responsibility for the incident.",Private Citizens & Property,Unknown,Explosives/Bombs/Dynamite,0,0
115875,201304140037,2013,4,14,Bahrain,Middle East & North Africa,Capital,Manama,26.216666999999998,50.583333,"04/14/2013: An explosives-laden vehicle detonated in the Financial Harbour district of Manama city, Capital governorate, Bahrain. There were no reported casualties or damages resulting from the blast. The February 14th Movement claimed responsibility for the incident, stating that they were in opposition to the Formula One race that was scheduled for the following week.",Unknown,February 14th Movement,Explosives/Bombs/Dynamite,0,0
116187,201304230045,2013,4,23,Bahrain,Middle East & North Africa,Muharraq,Muharraq,26.250622999999997,50.615187,"04/23/2013: An explosive device was found and defused in Muharraq city, Al Muharraq Governorate, Bahrain. No further information is available.",Unknown,Unknown,Explosives/Bombs/Dynamite,0,0
116359,201304280021,2013,4,28,Bahrain,Middle East & North Africa,Capital,Diah,26.225447999999997,50.535378,"04/28/2013: An explosive device detonated near a police patrol in Dia, Northern region, Bahrain. A police vehicle was damaged in the attack, but no casualties were reported. No group has claimed responsibility for the incident.",Police,Unknown,Explosives/Bombs/Dynamite,0,0
116383,201304280053,2013,4,28,Bahrain,Middle East & North Africa,Northern,Al-Malikiyah,26.099184,50.485253,"04/28/2013: Assailants opened fire on a police patrol in Al-Malkiya city, Northern region, Bahrain. No further information is available.",Police,Unknown,Firearms,0,0
116619,201305050026,2013,5,5,Bahrain,Middle East & North Africa,Southern,Jari Al Sheikh district,26.139048000000003,50.527792,"05/05/2013: Assailants attacked a police checkpoint with petrol bombs in Jari Al Sheikh district, Southern governorate, Bahrain. There were no reported casualties or injuries resulting from the attack. No group claimed responsibility for the incident; however, four people were arrested in connection with the attack.",Police,Unknown,Incendiary,0,0
117520,201305300022,2013,5,29,Bahrain,Middle East & North Africa,Northern,Bani Jamra,26.211389,50.459722,"05/29/2013: A remote-controlled explosive device detonated near police officers removing roadblocks in Bani Jamra village, Northern governorate, Bahrain. Seven officers were injured in the blast. Al-Ashtar Brigades claimed responsibility for the incident.",Police,Al-Ashtar Brigades,Explosives/Bombs/Dynamite,0,7
118652,201307070025,2013,7,6,Bahrain,Middle East & North Africa,Central,Wadiyan,26.157794,50.615846999999995,"07/06/2013: An explosive device detonated at a police station in Wadiyan village, Sitra island, Central governorate, Bahrain. One police officer was killed and two others were injured in the blast. No group claimed responsibility for the incident.",Police,Unknown,Explosives/Bombs/Dynamite,1,2
118653,201307070026,2013,7,6,Bahrain,Middle East & North Africa,Northern,Janabiya,26.184725,50.467002,"07/06/2013: Assailants threw Molotov cocktails at a police patrol in Janabiya village, Northern governorate, Bahrain. Three police officers were injured in the attack. No group claimed responsibility for the incident.",Police,Unknown,Incendiary,0,3
118844,201307130013,2013,7,13,Bahrain,Middle East & North Africa,Northern,Janabiya,26.184725,50.467002,"07/13/2013: Assailants remotely detonated a homemade bomb near Janabiyah village, Northern governorate, Bahrain. Four police officers were injured in the blast. No group claimed responsibility for the attack; however, sources attributed the attack to Shiite Muslims.",Police,Unknown,Explosives/Bombs/Dynamite,0,4
118930,201307150021,2013,7,15,Bahrain,Middle East & North Africa,Muharraq,Dair,26.284335,50.631781,"07/15/2013: Assailants threw petrol bombs at the home of Abbas Isa al-Madi in Dair town, Muharraq governorate, Bahrain. Al-Madi, a Member of Parliament (MP), was not injured, but the building was damaged in the fire. No group claimed responsibility for the incident; however, police later arrested three people in connection with the attack.",Government (General),Unknown,Incendiary,0,0
118995,201307170015,2013,7,17,Bahrain,Middle East & North Africa,Southern,Riffa,26.13,50.555,"07/17/2013: An explosives-laden vehicle detonated outside Shaikh Eisa Bin Salman Mosque in Riffa city, Southern governorate, Bahrain. There were no reported causalities in the explosion. Al Ashtar Brigades claimed responsibility for the attack.",Religious Figures/Institutions,Al-Ashtar Brigades,Explosives/Bombs/Dynamite,0,0
119349,201307250061,2013,7,25,Bahrain,Middle East & North Africa,Northern,Sehla,26.200592,50.535028000000004,"07/25/2013: Assailants threw incendiary devices at a residential building housing Bangladeshi workers in Sehla village, Northern governorate, Bahrain. There were no reported casualties; however, the building was damaged in the attack. No group claimed responsibility for the incident.",Private Citizens & Property,Unknown,Incendiary,0,0
119350,201307250062,2013,7,25,Bahrain,Middle East & North Africa,Northern,Saar,26.196111,50.486111,"07/25/2013: Assailants armed with homemade weapons attacked a civilian vehicle in Saar town, Northern governorate, Bahrain. The driver, who was an expatriate, was unhurt; however, the vehicle was damaged in the attack. No group claimed responsibility for the incident.",Private Citizens & Property,Unknown,Unknown,0,0
119351,201307250063,2013,7,25,Bahrain,Middle East & North Africa,Unknown,Unknown,,,"07/25/2013: Assailants fired a homemade projectile device at a civilian vehicle on Budaiya Highway, Bahrain. There were no reported injuries; however, the vehicle was slightly damaged. No group claimed responsibility for the incident.",Private Citizens & Property,Unknown,Explosives/Bombs/Dynamite,0,0
119394,201307270011,2013,7,27,Bahrain,Middle East & North Africa,Northern,Quraiya,26.200691,50.464318,"07/27/2013: An explosive device detonated on Janabiya Highway in Quraiya village, Northern governorate, Bahrain. Three police officers were wounded in the blast. No group claimed responsibility for the incident.",Private Citizens & Property,Unknown,Explosives/Bombs/Dynamite,0,3
119662,201308030001,2013,8,3,Bahrain,Middle East & North Africa,Northern,Budaiya,26.215822999999997,50.44972,"08/03/2013: One of two gas cylinders placed inside a vehicle detonated near a recreational area in Budaiya town, Northern governorate, Bahrain. There were no reported casualties. The Al-Ashtar Brigades claimed responsibility for the incident.",Private Citizens & Property,Al-Ashtar Brigades,Explosives/Bombs/Dynamite,0,0
119704,201308040016,2013,8,4,Bahrain,Middle East & North Africa,Unknown,Unknown,,,08/04/2013: An incendiary device was thrown at a police vehicle on patrol in an unknown location in Bahrain. One police officer was injured in the attack. No group claimed responsibility for the incident.,Police,Unknown,Incendiary,0,1
119952,201308110001,2013,8,11,Bahrain,Middle East & North Africa,Northern,Hamad,26.112924,50.499557,"08/11/2013: Assailants threw an incendiary device at the Al Manhal Primary Girls School in Hamad town, Northern governorate, Bahrain. There were no reported casualties; however, the school's fence was damaged in the attack. No group claimed responsibility for the incident.",Educational Institution,Unknown,Incendiary,0,0
120050,201308140002,2013,8,14,Bahrain,Middle East & North Africa,Central,Nuwaidrat,26.133556,50.597435,"08/14/2013: Assailants threw petrol bombs at an Asian worker who was attempting to dismantle barricades erected by opposition elements in Nuwaidrat village, Central governorate, Bahrain. The targeted worker was seriously injured in the attack. No group claimed responsibility for the incident.",Private Citizens & Property,Unknown,Incendiary,0,1
120144,201308170002,2013,8,17,Bahrain,Middle East & North Africa,Muharraq,Dair,26.286528000000004,50.623622999999995,"08/17/2013: An explosive device detonated during a confrontation between opposition protesters and Bahraini police officers in Dair village, Muharraq island, Bahrain. At least one police officer was killed and at least four others were injured in the blast. The Popular Resistance Brigade claimed responsibility for the incident.",Police,Popular Resistance Brigade,Explosives/Bombs/Dynamite,1,4
120347,201308230033,2013,8,23,Bahrain,Middle East & North Africa,Muharraq,Muharraq,26.270635,50.640739,"08/23/2013: Assailants threw Molotov cocktails at Doctor Abdullah Al-Magabi in Muharraq city, Muharraq governorate, Bahrain. Al-Magabi, a cleric, was unharmed by the attack. No group claimed responsibility for the incident.",Religious Figures/Institutions,Unknown,Incendiary,0,0
120369,201308240027,2013,8,24,Bahrain,Middle East & North Africa,Central,Sitra,26.162717999999998,50.611959999999996,"08/24/2013: An explosive device placed in a company's parking lot was defused in the Sitra area, Central governorate, Bahrain. No group claimed responsibility for the incident.",Business,Unknown,Explosives/Bombs/Dynamite,0,0
120533,201308290001,2013,8,29,Bahrain,Middle East & North Africa,Capital,Sahla,26.201423000000002,50.533026,"08/29/2013: An explosives-laden vehicle detonated near a Bahraini police patrol in the predominantly Shiite village of Sahla, Capital governorate, Bahrain. Four police officers were injured in the blast. No group claimed responsibility for the incident.",Police,Unknown,Explosives/Bombs/Dynamite,0,4
120779,201309050032,2013,9,5,Bahrain,Middle East & North Africa,Central,Wadyan,26.157521,50.615893,"09/05/2013: An explosive device placed in an empty house detonated near a police patrol in Wadayan village, Central governorate, Bahrain. No one was injured in the blast; however, part of the house and a car parked nearby were damaged. No group claimed responsibility for the incident.",Police,Unknown,Explosives/Bombs/Dynamite,0,0
120780,201309050033,2013,9,5,Bahrain,Middle East & North Africa,Capital,Manama,26.216666999999998,50.583333,"09/05/2013: An explosive device placed in a box was found on Avenue 28, Manama city, Capital governorate, Bahrain. The outcome of the incident is unknown; however, security officials found the device and cleared the area. No group claimed responsibility for the incident.",Unknown,Unknown,Explosives/Bombs/Dynamite,0,0
121172,201309170025,2013,9,17,Bahrain,Middle East & North Africa,Central,Isa Town,26.173588,50.547856,"09/17/2013: Police discovered and defused an explosive device on Shaikh Salman road in Isa town, Central governorate, Bahrain. No group claimed responsibility for the incident.",Unknown,Unknown,Explosives/Bombs/Dynamite,0,0
121491,201309280043,2013,9,27,Bahrain,Middle East & North Africa,Central,Jurdab,26.168217000000002,50.571804,"09/27/2013: An explosive device detonated in a shopping and residential area of Jurdab village, Central governorate, Bahrain. At least one person was injured as several buildings, shops, and vehicles were also damaged in the blast. No group claimed responsibility for the attack.",Private Citizens & Property,Unknown,Explosives/Bombs/Dynamite,0,1
122068,201310140031,2013,10,14,Bahrain,Middle East & North Africa,Central,Tubli,26.188889,50.55,"10/14/2013: An explosive device was discovered and defused near a local market in Tubli village, Central governorate, Bahrain. No group claimed responsibility for this incident.",Private Citizens & Property,Unknown,Explosives/Bombs/Dynamite,0,0
122200,201310190029,2013,10,19,Bahrain,Middle East & North Africa,Northern,Abu Saiba,26.217347999999998,50.504264,"10/19/2013: An explosive device detonated near the entrance to Abu Saiba town, Northern governorate, Bahrain. There were no reported casualties; however, a Public Security Force (PSF) vehicle was damaged by the blast. No group claimed responsibility for the incident.",Police,Unknown,Explosives/Bombs/Dynamite,0,0
122286,201310220025,2013,10,22,Bahrain,Middle East & North Africa,Northern,Bani Jamra,26.211389,50.459722,"10/22/2013: An explosive device detonated prematurely as it was being transported to an attack in Bani Jamra village, Northern governorate, Bahrain. The person carrying the device was killed in the blast and one other person was injured. No group claimed responsibility for the incident.",Unknown,Unknown,Explosives/Bombs/Dynamite,1,1
122467,201310260036,2013,10,26,Bahrain,Middle East & North Africa,Northern,Demistan,26.123784,50.469588,"10/26/2013: An explosive device detonated targeting a police patrol in Demistan town, Northern governorate, Bahrain. Several police officers were wounded in the attack. No group claimed responsibility for the incident.",Police,Unknown,Explosives/Bombs/Dynamite,0,0
124591,201312170063,2013,12,17,Bahrain,Middle East & North Africa,Northern,Demistan,26.123820000000002,50.469628,"12/17/2013: An explosive device detonated as Public Security Force (PSF) officers attempted to remove debris in Demistan city, Northern governorate, Bahrain. Two police officers were injured as a result of the blast. No group claimed responsibility for the incident.",Police,Unknown,Explosives/Bombs/Dynamite,0,2
124938,201312270011,2013,12,27,Bahrain,Middle East & North Africa,Capital,Maqsha,26.221405999999998,50.516216,"12/27/2013: An explosive device detonated near police officers on al-Bade e street in Maqsha a village, Capital governorate, Bahrain. Two police officers were injured in the blast. No group claimed responsibility for the incident.",Police,Unknown,Explosives/Bombs/Dynamite,0,2
124966,201312280007,2013,12,28,Bahrain,Middle East & North Africa,Capital,Manama,26.234071000000004,50.593744,"12/28/2013: Police discovered and defused an explosives-laden vehicle in the Hoora area of Manama city, Capital governorate, Bahrain. No group claimed responsibility for the incident.",Unknown,Unknown,Explosives/Bombs/Dynamite,0,0
